Year,Subject,Chapter,Level,Category,Stem,Stem Image,Question_A,Question_B,Question_C,Question_D,Ans_A,Ans_B,Ans_C,Ans_D
2019,Agriculture 1st Paper,Agriculture Information and Services,Rajshahi Board,Board,"Sujan Mia is a farmer from Phultola village. To go to the market from home, he has to travel four kilometers in the scorching sun at noon. There is no shade anywhere to rest. Therefore, after discussing with a few farmers, he planted some forest tree saplings along the entire road. They decided to distribute the produced goods according to a contract.",NA,What is a field crop?,Why is tomato a horticultural crop? Explain.,Which sector of agriculture does the crop in the stem belong to? Explain.,Evaluate Sujan Mia's initiative in the context of Bangladesh.,"Field crops are those crops that are grown on a large scale in open fields for the purpose of food, fiber, or industrial use, such as rice, wheat, and jute.","Tomato is considered a horticultural crop because it requires intensive care, individual attention, and is typically grown on a smaller scale compared to field crops. It is highly perishable and has a high moisture content, which are key characteristics of horticultural produce.


Additionally, tomatoes are often grown in kitchen gardens or specialized plots with fencing and specific irrigation needs. Their cultivation is more focused on nutritional value and high market price per unit of land, fitting perfectly into the definition of vegetable horticulture.","The activity mentioned in the stem belongs to the Social Forestry (সামাজিক বনায়ন) sector of agriculture. This is a specialized branch where trees are planted and managed with the active participation of the local community on fallow lands or roadsides.


In the stem, Sujan Mia and other farmers took the initiative to plant trees along a public road for shade and future production. This move from individual farming to a community-based plantation is a core feature of social forestry. The goal is to maximize the utility of unused land for environmental and economic benefits.


Furthermore, the mention of a ""contract"" for distributing the produced goods (timber, fruit, or fuel) confirms it is social forestry. This sector ensures that the benefits of the forest are shared among the participants who take care of the trees, making it a sustainable agricultural model for rural development.","Sujan Mia’s initiative is highly significant and commendable in the context of Bangladesh, as it addresses environmental, social, and economic challenges simultaneously.


Environmental Restoration: Bangladesh is a country with limited forest cover. By planting trees along the four-kilometer road, Sujan Mia is directly contributing to the ecological balance, reducing the local temperature, and providing a carbon sink. This helps mitigate the effects of climate change at a local level.


Socio-Economic Benefits: The ""contract"" for distributing products ensures that the participating farmers will have an additional source of income in the future from timber and fruits. This acts as a safety net for rural families. Moreover, the shade provided by the trees makes the road more accessible for travelers and workers during the hot summer months, improving local infrastructure utility.


Sustainable Land Use: In a land-scarce country like ours, utilizing roadsides for tree plantation is an excellent example of vertical and marginal land management. Sujan Mia's initiative proves that agriculture can extend beyond traditional fields into public spaces to create ""green belts"" that protect the soil from erosion and provide natural resources without taking away land from food crops.


Conclusion: Sujan Mia's initiative serves as an ideal model for the ""Social Forestry Program"" of the government. It encourages community participation and self-reliance. If such initiatives are replicated across the country, it will not only make Bangladesh greener but also strengthen the rural economy through the sustainable management of forest resources."
2018,Agriculture 1st Paper,Agriculture Information and Services,Rajshahi Board,Board,"Jewel and Kader are two friends. After finishing their studies, they visit a research institute located in Joydebpur, Gazipur district, with the purpose of seeing it. After going there, they learn that the institute researches only rice. So far, the institute has developed sixty-two varieties of rice, most of which are high-yielding. Additionally, it has developed varieties of rice enriched with protein and zinc. In this way, the institute continues to provide assistance to farmers. Jewel and Kader believe that the institute will play an important role in the future to meet the food demand of the sixteen crore people of this country.",NA,What is agricultural information?,Why is ratoon crop cultivation profitable? Explain.,What is the name of the institute Jewel and Kader visited? What kind of assistance is the institute providing to the farmers? Explain.,What impact will the research institute seen by Jewel and Kader have on meeting the country's food demand in the future? Analyze in light of the stem.,"Agricultural information refers to the latest data, scientific findings, and technological updates regarding crop cultivation, livestock rearing, and soil management used to improve productivity.","Ratoon crop cultivation is profitable primarily because it eliminates the need for repeated land preparation, sowing, or transplanting, which significantly reduces labor and material costs. Since the new crop grows from the stubble of the previously harvested one, the initial growth period is shorter, leading to a quicker harvest.


Furthermore, this method requires less irrigation and fewer chemical inputs compared to a fresh plantation. In a country with limited land resources, ratoon cropping allows farmers to maximize their yield over a single year without the heavy financial burden of starting a completely new crop cycle, thereby increasing their net profit margin.","The institute visited by Jewel and Kader is the Bangladesh Rice Research Institute (BRRI). As described in the stem, this specialized institute is located in Joydebpur, Gazipur, and focuses exclusively on the research and development of rice varieties to ensure national food security.



BRRI provides vital technical assistance to farmers by developing and disseminating high-yielding varieties (HYV) that are suited to different agro-ecological zones of Bangladesh. By releasing sixty-two varieties (as per the stem), they offer farmers options that are resistant to pests, diseases, and climate stresses like drought or salinity.


Additionally, the institute assists farmers by providing scientific guidelines on modern cultivation practices and balanced fertilizer usage. By introducing bio-fortified rice enriched with essential nutrients like zinc and protein, BRRI helps farmers produce crops that not only increase their income through higher yields but also contribute to improving the nutritional health of the rural population.","The research institute (BRRI) will play a transformative role in meeting the future food demands of Bangladesh by ensuring a steady increase in production despite decreasing arable land and a growing population.


Ensuring Food Security: With sixteen crore people to feed, the development of high-yielding varieties is a mechanical necessity. The stem mentions that most of the 62 varieties developed are high-yielding; these varieties produce significantly more grain per hectare than traditional ones. This increased productivity is the only way to sustain national self-sufficiency in rice, the country's primary staple food.


Nutritional Security: The future impact of BRRI extends beyond just quantity to the quality of food. By developing rice enriched with protein and zinc, as noted in the stem, the institute is addressing the ""hidden hunger"" or micronutrient deficiencies prevalent in the country. This ensures that the future generation is not only fed but also healthy, which is crucial for long-term national development.


Climate Resilience and Sustainability: As environmental challenges like salinity and floods increase, the institute’s role in breeding stress-tolerant rice varieties becomes vital. By providing farmers with seeds that can survive extreme weather, BRRI minimizes the risk of total crop failure. This stability in production protects the national economy from the need for expensive food imports and keeps market prices stable for the general population.


Conclusion: Therefore, the scientific advancements made by this institute act as the backbone of Bangladesh's agricultural resilience. As Jewel and Kader believe, the continuous innovation in rice genetics and farming technology will be the key factor in feeding the nation's millions in the decades to come. The institute’s ongoing support transforms traditional farming into a modern, science-based industry capable of meeting any future crisis."
2018,Agriculture 1st Paper,Agriculture Information and Services,Dhaka Board,Board,Observe the images below and answer the questions: [Image-1: A laptop showing agricultural data; Image-2: A smartphone/mobile device].,"""C:\Users\BMTF\.antigravity\testpaper\Agri1_Ch_Cq_Image\agri1_Ch1_CQ16.png""",What is a field crop?,Why is social forestry important?,Explain the role of Image-2 of the stem in obtaining agricultural information and services.,"Between Image-1 and Image-2, which one is more useful for agricultural development? Give arguments in favor of your opinion.","Field crops are those crops that are grown on a large scale in wide, open fields for the purpose of food, fiber, or industrial raw materials, such as rice, wheat, and jute.","Social forestry is crucial because it involves the active participation of local communities in planting and managing trees on fallow lands, roadsides, and embankments. This helps in meeting the local demand for fuel, timber, and fodder while preventing soil erosion and maintaining ecological balance.


Furthermore, it provides an additional source of income for rural families and improves the overall socio-economic condition of the community. By creating a green belt, it protects the environment from the adverse effects of climate change and enhances the beauty of the countryside.","Image-2 represents a smartphone or mobile device, which plays a vital role as a primary tool for e-Agriculture in Bangladesh. It allows farmers to access real-time information through various agricultural mobile apps and SMS services, enabling them to make informed decisions about seed selection, weather patterns, and market prices.


One of the most significant roles is the ability to use ""Agriculture Call Centers"" (e.g., dialing 16123). This service provides direct access to agricultural experts who can diagnose crop diseases or pest attacks through verbal descriptions or photos sent via the device, offering immediate and expert remedies without the farmer needing to travel.


Additionally, mobile banking and digital payment systems integrated into these devices facilitate easy transactions for purchasing fertilizers and seeds. This digital connectivity reduces the gap between research institutions and the grassroots farmer, making information dissemination faster and more cost-effective than traditional methods.","Both Image-1 (laptop/computer) and Image-2 (smartphone) are essential tools for agricultural development, but Image-2 (Smartphone) is arguably more useful and impactful for the majority of farmers in the context of Bangladesh.


Portability and Accessibility: A smartphone is highly portable and can be carried directly into the field, allowing farmers to capture images of pests or diseased crops and receive immediate expert advice on-site. In contrast, a laptop (Image-1) requires a stable surface and is less convenient for real-time field diagnostics.


Cost-Effectiveness and Infrastructure: For a typical Bangladeshi farmer, a smartphone is more affordable than a laptop. Furthermore, mobile network coverage is significantly more widespread in rural areas compared to broadband or fixed-line internet required for optimal laptop use. This makes the smartphone a more democratic tool for information access among small-scale farmers.


Ease of Use: Modern agricultural apps and voice-command features on smartphones are designed for users with varying levels of literacy. Features like ""voice-to-text"" or calling expert helplines make it easier for farmers to communicate their problems compared to the more complex interface of a laptop, which often requires a higher level of technical proficiency.


Conclusion: While the laptop is superior for complex data analysis, research, and managing large-scale farm databases, the smartphone is the ultimate tool for ""last-mile"" delivery of information. Its ability to provide real-time, on-site solutions and financial services makes it the more effective and practical choice for driving agricultural development at the grassroots level in Bangladesh."
2017,Agriculture 1st Paper,Agriculture Information and Services,Dhaka Board,Board,Observe the image below and answer the questions: .,"""C:\Users\BMTF\.antigravity\testpaper\Agri1_Ch_Cq_Image\agri1_Ch1_CQ17.png""",What is agricultural education?,How is a mobile phone used in agricultural information services? Explain.,Which type of crop does the plant shown in the image belong to? Explain.,Is the cultivation of the plant shown in the image profitable? Give arguments in favor of your opinion.,"Agricultural education is the process of acquiring scientific knowledge, technical skills, and practical training related to crop production, livestock, fisheries, and forestry to improve agricultural productivity.","A mobile phone acts as a dynamic bridge between agricultural experts and farmers, allowing for the instant exchange of information. Farmers can dial dedicated helplines (like 16123 in Bangladesh) to speak directly with specialists about crop diseases, pest control, and soil management without leaving their fields.


Furthermore, smartphones allow farmers to use dedicated agricultural apps and social media groups to share photos of affected plants for visual diagnosis. This digital connectivity ensures that even remote farmers receive timely weather alerts and market price updates, which significantly reduces the risks associated with traditional farming.","The plant shown in the image is an Eggplant (Brinjal), which belongs to the category of Horticultural Crops. Horticultural crops are specifically defined as those that are usually cultivated on a smaller scale, often in gardens or high lands, and require intensive care, individual attention, and specialized management throughout their growth cycle.



Eggplant is considered a horticultural crop because it requires meticulous nursery management, transplanting of seedlings, and continuous weeding and irrigation. Unlike field crops that are grown over vast areas with collective management, each eggplant plant needs individual monitoring for pests like the fruit and shoot borer to ensure a healthy harvest.


Additionally, these crops are mostly consumed fresh and have a higher moisture content compared to field crops. They are typically grown in a defined ""garden"" setting (Udyan) rather than open ""fields"" (Math), making them a staple example of intensive vegetable cultivation in the horticultural sector.","Cultivating the plant shown in the image (Eggplant) is highly profitable from an economic and nutritional perspective in the context of Bangladesh.


High Market Demand: Eggplant is a versatile vegetable consumed daily by almost every household in the country, ensuring a constant and high demand in the market. Since it can be grown in multiple seasons (Kharif and Rabi), farmers can maintain a steady cash flow throughout the year by supplying fresh produce to urban centers where prices remain relatively stable and high.


High Yield in Limited Space: As a horticultural crop, eggplant provides a much higher yield per unit of land compared to traditional field crops like rice or wheat. Farmers with small landholdings can maximize their income by practicing intensive cultivation, utilizing high-yielding and hybrid varieties that produce a large number of fruits per plant, thus significantly increasing the net profit margin.


Nutritional and Social Value: Beyond financial gain, cultivating eggplant contributes to the nutritional security of the farmer's family by providing essential vitamins and minerals. It also creates employment opportunities for rural women and youth in activities like harvesting, sorting, and packaging, which strengthens the local rural economy and reduces poverty at the grassroots level.


Conclusion: Therefore, due to its low initial investment relative to its high market return and the possibility of year-round production, eggplant cultivation is a strategic and profitable choice for farmers. With the help of modern agricultural technology and proper pest management, it remains one of the most commercially viable vegetable crops for small and medium-scale farmers in Bangladesh."
2017,Agriculture 1st Paper,Agriculture Information and Services,Jessore Board,Board,"Mr. Zaman went to the Upazila Agriculture Officer because he was making less profit by cultivating rice in the Aman season. The Agriculture Officer discussed various fields of agriculture with him. He advised him to cultivate vegetables by applying an adequate amount of organic fertilizer to the land. He also advised him to apply irrigation and pesticides at the right time. Although the production cost increased due to this, Mr. Zaman became more profitable than before.",NA,What is the full form of BARI?,Why is an experienced farmer called a local information store? Explain.,Discuss comparatively between the fields of crops mentioned in the stem.,Evaluate the appropriateness of the Agriculture Officer's advice in making Mr. Zaman profitable.,The full form of BARI is Bangladesh Agricultural Research Institute.,"An experienced farmer is called a local information store because they possess extensive practical knowledge about local soil conditions, weather patterns, and crop varieties through years of hands-on experience. This indigenous technical knowledge (ITK) is often more relevant to the specific needs of local farmers than generic scientific data.


Furthermore, they serve as a primary source of advice for other farmers in the community regarding traditional pest control and organic farming techniques. Because they are easily accessible and speak the local language, their ""store"" of information is the most trusted resource for solving immediate agricultural problems in the village.","The stem mentions two distinct fields of crops: Field Crops (represented by the rice Mr. Zaman originally cultivated) and Horticultural Crops (represented by the vegetables recommended by the officer).


Field crops like rice are generally grown on a large scale in wide, open fields for mass consumption and food security. These crops usually have a lower market price per unit compared to vegetables and are often cultivated with less intensive individual plant care. In the stem, Mr. Zaman's initial focus on Aman rice highlights the large-scale, staple nature of field crops which sometimes yield lower profit margins due to high competition and lower unit prices.


On the other hand, horticultural crops like vegetables are grown on a smaller scale, often in gardens or high lands, and require intensive care, such as the specific irrigation and pest management mentioned by the officer. These crops have a higher moisture content and are highly perishable, but they command a much higher price in the market. By shifting focus toward these, Mr. Zaman was able to utilize organic fertilizers to enhance soil health and produce high-value commodities that significantly increased his income.","The advice provided by the Agriculture Officer was highly appropriate and strategically sound for increasing Mr. Zaman's profitability, as it addressed the core issues of soil health and high-value production.


Soil Health through Organic Fertilizer: By recommending an ""adequate amount of organic fertilizer,"" the officer addressed the potential soil exhaustion caused by continuous rice cultivation. Organic matter improves soil structure, water retention, and microbial activity, leading to healthier crops and better yields. This sustainable approach reduces the long-term dependency on expensive chemical fertilizers, which eventually lowers production costs relative to the output.


Shift to High-Value Crops: The transition from Aman rice (a field crop) to vegetables (horticultural crops) was the primary driver of profit. Vegetables have a higher market value per decimal of land and a shorter life cycle, allowing for multiple harvests in a year. Even though the officer warned that production costs (for irrigation and pesticides) would increase, the higher market price of vegetables more than compensated for these expenses, leading to a better net profit.


Precision Farming and Management: The officer's emphasis on applying irrigation and pesticides ""at the right time"" represents a move toward precision agriculture. Timing is critical in vegetable cultivation to prevent pest outbreaks and ensure optimal growth. This professional management style minimizes waste and ensures that every taka spent on inputs contributes directly to increasing the quality and quantity of the produce.


Conclusion: Therefore, the Agriculture Officer's intervention was successful because it combined technical soil management with commercial crop selection. Mr. Zaman’s increased profitability proves that modern agricultural advice, focusing on intensive care and high-value outputs, is essential for transforming traditional farming into a commercially viable enterprise. The officer’s plan was a perfect balance of scientific practice and economic reality."
