Year,Subject,Chapter,Level,Category,Stem,Stem Image,Question_A,Question_B,Question_C,Question_D,Ans_A,Ans_B,Ans_C,Ans_D
2026,Agriculture 1st Paper,Bangladesh Agriculture and Agricultural Institutions,"Rajuk Uttara Model College, Dhaka",college,"Agriculturist Mr. Delwar joined the Bangladesh Rice Research Institute as a scientific officer after receiving higher education from Bangladesh Agricultural University. He has enriched Bangladesh's agriculture by inventing new technologies through relentless research. When he attends various seminars, he often says, ""The importance of agricultural education for the development of the agricultural sector is immense.""",NA,What is agricultural education?,What are the sources of getting information and services in the agriculture of Bangladesh?,Describe the work of the research institute joined by Mr. Delwar.,Analyze the statement of Mr. Delwar mentioned in the stem.,"Agricultural education is the systematic process of acquiring knowledge, skills, and training related to crop production, livestock rearing, fisheries, forestry, and overall agricultural management.","The primary sources of obtaining agricultural information and services in Bangladesh include institutional sectors like the Department of Agricultural Extension (DAE), Bangladesh Agricultural Research Council (BARC), and various specialized research institutes (e.g., BRRI, BARI). Additionally, digital platforms like agricultural call centers (16123), agricultural websites, and mobile apps serve as modern sources.


Furthermore, non-governmental organizations (NGOs) like BRAC, community-based agricultural clubs, input dealers (seed, fertilizer, and pesticide sellers), and local progressive farmers play a crucial role. Mass media, including specialized television programs (like 'Hridoye Mati O Manush'), radio broadcasts, and agricultural community radio stations, also extensively disseminate timely agricultural advice and services directly to the farmers.","The research institute joined by Mr. Delwar is the Bangladesh Rice Research Institute (BRRI). The primary responsibility of this national institution is to conduct extensive research on rice production, develop high-yielding variety (HYV) rice strains, and innovate modern production technologies to ensure food security in Bangladesh.


BRRI works closely on developing climate-resilient rice varieties, such as flood-tolerant, drought-tolerant, and salinity-tolerant strains, which help farmers maintain crop yields despite adverse environmental conditions. The institution also conducts experiments on pest management, soil health optimization, fertilizer management, and the mechanization of rice cultivation to reduce production costs.


Furthermore, BRRI transfers its innovated technologies and practices to farmers through training programs, workshops, and publications in collaboration with extension departments. By consistently producing improved breeder seeds and introducing sustainable farming methodologies, the institute plays a monumental role in keeping the nation self-sufficient in its staple food.","In the stem, Mr. Delwar emphasized that ""The importance of agricultural education for the development of the agricultural sector is immense."" This statement is completely accurate because sustainable agricultural development is impossible without scientific knowledge, skilled manpower, and modern technology, all of which are rooted in comprehensive agricultural education.


Firstly, agricultural education transforms traditional farming practices into modern, scientific operations. Through institutional education at various levels, farmers and professionals learn about advanced soil management, precise fertilizer application, climate-smart crop rotation, and balanced animal husbandry, which significantly increases productivity while minimizing environmental degradation.


Secondly, agricultural education fosters innovation and creates a workforce of agricultural experts, researchers, and extension officers. Experts like Mr. Delwar are products of agricultural universities who invent high-yielding, stress-tolerant crop varieties and automated machinery. Without this educational foundation, the country would lack the intellectual capital required to tackle emerging threats like climate change, pest outbreaks, and declining arable land.


In conclusion, agricultural education serves as the backbone of food security and rural economic development. It bridges the gap between laboratory research and field-level implementation, empowering farmers to transition from subsistence farming to commercial agribusiness, thereby validating Mr. Delwar's assertion."
2026,Agriculture 1st Paper,Bangladesh Agriculture and Agricultural Institutions,"Milestone College, Dhaka",college,"Bangladesh's second-largest university has been established on about 1261 acres of land on the western bank of the Old Brahmaputra River, 4 kilometers south of Mymensingh city. This campus is located 120 kilometers north of the capital city, Dhaka. It is an agriculture-related government university. Established on August 18, 1961, the institution currently has 44 departments operating.",NA,What is agricultural education?,What type of crop is potato? Explain.,Describe the objectives and functions of the institution mentioned in the stem.,Analyze the role that the institution mentioned in the stem is playing in the agricultural education and research of Bangladesh.,"Agricultural education is the process of acquiring systematic knowledge, practical skills, and scientific training related to crop production, livestock rearing, fisheries, forestry, and overall agricultural management.","Potato is a modified underground stem crop, botanically classified as a tuber crop. It serves as a major non-cereal carbohydrate source and is consumed globally as a highly versatile vegetable and staple food.


The plant stores excess food material in its underground stem branches, which swell up to form tubers. Rich in starch, vitamins, and minerals, potato plays a vital role as a cash crop in Bangladesh's winter season, filling nutritional gaps and ensuring dietary diversification alongside rice and wheat.","The institution indicated in the stem is Bangladesh Agricultural University (BAU). The primary objective of this pioneer institution is to produce highly skilled, technically proficient, and scientifically sound agricultural graduates, postgraduates, and researchers to lead the country's agrarian economy.


The key functions of BAU revolve around providing top-tier academic education across various faculties, including Agriculture, Veterinary Science, Animal Husbandry, Agricultural Engineering, Fisheries, and Agricultural Economics. The university designs modern curricula, conducts theoretical and hands-on laboratory experiments, and coordinates comprehensive field-level practical trials for its students.


Furthermore, BAU acts as a primary hub for advanced research, collaborating with national and international research organizations to solve complex agricultural problems. Through its extension services, the university also plays an essential role in transferring laboratory-developed technologies and farming techniques directly to rural communities, thereby contributing to rural empowerment.","The institution mentioned in the stem is Bangladesh Agricultural University (BAU), which plays a monumental and foundational role in shaping the agricultural education and research landscape of Bangladesh. As the nation's premier higher agricultural seat, its contributions form the backbone of the country's food security achievements.


In terms of agricultural education, BAU acts as the primary reservoir for producing skilled human resources. The university has generated thousands of agronomists, veterinarians, agricultural engineers, and fisheries experts who populate the country's extension departments, ministries, and private agribusinesses. By offering diverse, specialized departments, it ensures that every facet of modern agricultural science is addressed with academic rigor.


In the realm of agricultural research, BAU's contribution is peerless. Through its dedicated research wing, the Bangladesh Agricultural University Research System (BAURES), the university has innovated numerous high-yielding crop varieties, improved livestock breeds, and efficient aquaculture techniques. Notable breakthroughs include the development of modern rice varieties, advanced artificial insemination techniques, and eco-friendly pest management protocols.


In conclusion, BAU successfully bridges the gap between educational theory and transformative research. Its continuous supply of expert professionals and climate-resilient technologies has allowed Bangladesh to transition from a food-deficient nation to a self-sufficient one, fully justifying its status as the nucleus of the country's agricultural progress."
2026,Agriculture 1st Paper,Soil and Soil Properties,"Cantonment Public School and College, Mymensingh",college,"Sohel came from Rangpur to visit his maternal uncle's house in Madhupur of Tangail district. One day, his uncle took him around to see the pineapple gardens of Madhupur. From there, his uncle took him to his maternal aunt's house in Kushtia. There, he saw fields full of lentils, cotton, and sugarcane. He asked his uncle why different crops grow well in different regions. His uncle replied that this happens due to variations in the soil.",NA,What is soil fertility?,Why is soil conservation necessary?,Describe the necessary steps for the production of the cotton crop mentioned in the stem.,Evaluate the logical justification of the statement made by Sohel's uncle.,Soil fertility is the natural capacity of the soil to supply essential plant nutrients in balanced amounts and readily available forms for optimum plant growth.,"Soil conservation is necessary to prevent the loss of the topsoil layer due to erosion caused by water, wind, and human activities. The topsoil contains the highest amount of organic matter and essential nutrients required for plant nutrition, and losing it severely impacts agricultural yield.


Furthermore, conservation helps maintain soil moisture retention capacity, balances the microbial ecosystem, and prevents desertification. By preserving the structural integrity of the soil, it ensures sustainable food production, prevents environmental degradation, and preserves lands for future generations.","The cotton crop mentioned in the stem grows exceptionally well in the calcareous and fertile soils of regions like Kushtia. The production of cotton requires systematic steps, starting with thorough land preparation involving deep plowing and harrowing to achieve a fine tilth, followed by proper drainage management.


The next critical steps include seed selection, treatment, and sowing. High-quality, disease-resistant cotton seeds should be selected and treated with proper fungicides before sowing. Seeds are generally sown in lines keeping optimum row-to-row and plant-to-plant distance during the early Kharif season or late Rabi season depending on the variety.


Finally, intercultural operations and harvesting complete the production cycle. Regular weeding, thinning, balanced fertilizer application (comprising nitrogen, phosphorus, potash, and sulfur), and controlled irrigation are essential. Pests like bollworms must be managed using integrated pest management (IPM) practices, and the cotton bolls should be hand-picked cleanly when they mature and open up completely.","The statement made by Sohel's uncle that ""different crops grow well in different regions due to variations in the soil"" is highly logical and scientifically accurate. Soil is a complex dynamic medium, and its physical, chemical, and biological properties vary widely across different Agro-Ecological Zones (AEZs) in Bangladesh.


Firstly, the soil of Madhupur in Tangail belongs to the Madhupur Tract, which consists of red, highly weathered, clayey, and acidic soil. This specific type of soil, rich in iron and aluminum oxides with good drainage on hilly or high terraces, provides the ideal acidic pH and environmental conditions required for thriving pineapple plantations.


Secondly, the soil of Kushtia falls under the Ganges Floodplain, characterized by calcareous, loamy to clay loamy texture with a neutral to slightly alkaline pH. This nutrient-rich alluvial soil has high water-holding capacity and mineral content, which is perfectly suited for tap-rooted cash crops like cotton, deep-rooting sugarcane, and drought-tolerant pulses like lentils.


In conclusion, crop distribution is heavily dependent on soil characteristics such as texture, pH, organic matter content, and moisture retention. Farmers naturally select crops that match the intrinsic attributes of their regional soil to ensure high yield and economic profitability. Therefore, his uncle's explanation precisely captures the fundamental relationship between soil diversity and regional agricultural patterns."
2026,Agriculture 1st Paper,Bangladesh Agriculture and Agricultural Institutions,"Cantonment Public School and College, Mymensingh",college,"Rice farmer Rafiq Miah often faces various problems. A friend of his informs him that with the help of information technology at home, one can get necessary advice to improve crop yield and control pests and diseases. The friend advises him to contact a special institution that helps farmers not only with rice but also with improving the cultivation of crops like fisheries, cotton, tea, silk, etc., and using new technology and machinery in this regard.",NA,What is BARI?,Write the functions of Agricultural Information Service (AIS).,Describe the role of the institution mentioned in the stem in disseminating agricultural technology.,Evaluate the importance of the advice given by Rafiq Miah's friend.,"BARI stands for Bangladesh Agricultural Research Institute, which is the largest multi-crop research institution in the country conducting research on various non-rice crops.","The Agricultural Information Service (AIS) serves as the primary mass communication wing of the Ministry of Agriculture. Its primary role is to collect modern, scientific agricultural technologies from research institutes and translate them into simple, understandable messages for farmers through mass media.


Furthermore, AIS publishes agricultural magazines (like 'Krishi Kotha'), scripts and broadcasts radio and television programs (such as 'Mati O Manush' or 'Banglar Krishi'), manages specialized agricultural mobile applications, and operates the agricultural call center helpline (16123) to deliver immediate solutions to farmers' field problems.","The special institution mentioned in the stem that coordinates the improvement and dissemination of diverse agricultural sectors (including crops, fisheries, cotton, tea, silk, etc.) and machinery is the Department of Agricultural Extension (DAE) acting under the broader umbrella of agricultural extension services.


DAE plays a pivotal role in technology dissemination by bridging the gap between research laboratories and actual field implementation. Block-level Sub-Assistant Agriculture Officers (SAAOs) work directly at the grassroots level, holding yard meetings, training workshops, and method demonstrations to teach farmers how to properly apply new techniques, operate advanced machinery, and use high-yielding seeds.


Furthermore, the institution sets up practical demonstration plots in farmers' fields to visibly show the superior results of newly developed technologies over traditional methods. By providing timely field advisories, distributing subsidized machinery, and organizing agricultural fairs, it accelerates the mass adoption of sustainable and modernized farming practices across the country.","The advice given by Rafiq Miah's friend is highly significant, timely, and carries immense practical importance for transitioning traditional subsistence farming into a profitable and technologically advanced enterprise.


Firstly, the advice introduces the power of Information and Communication Technology (ICT) into a farmer's daily workflow. By accessing digital resources, agricultural call centers, and websites from home, Rafiq Miah can save valuable time and money that would otherwise be spent traveling to sub-district offices, allowing him to diagnose crop diseases and implement pest management strategies before major damage occurs.


Secondly, the advice guides him toward institutional help from professional bodies like DAE. This opens up opportunities for diversification; instead of relying solely on risky or low-profit traditional rice farming, Rafiq Miah can learn scientific methods for high-value ventures like fisheries, cotton, or silk cultivation, significantly improving his financial security and expanding his livelihood choices.


In conclusion, his friend's advice acts as an eye-opener that empowers a grassroot farmer with knowledge-based solutions. It bridges the information gap, reduces dependency on unreliable local middlemen, and motivates the adoption of modernized tools and techniques, making it absolutely crucial for ensuring economic prosperity and sustainable agricultural growth."
2025,Agriculture 1st Paper,Crop Cultivation,"Rajuk Uttara Model College, Dhaka",college,"Rafiz goes to visit his village home during the winter vacation. He sees that his uncle has cultivated one type of crop on low and medium-low lands, and another type of crop on high lands. By talking to his uncle, Rafiz learns about the differences between field crops and horticultural crops. Finally, his uncle says, ""The cultivation of horticultural crops is more profitable.""",NA,What is agriculture?,What are the sources of getting information and services in the agriculture of Bangladesh?,Determine the differences between the crops mentioned in the above stem.,Analyze the final statement of Rafiz's uncle mentioned in the above stem.,"Agriculture is the primary production sector that involves the scientific cultivation of land to produce crops, along with the rearing of livestock, poultry, fisheries, and forestry for human sustenance.","The primary institutional sources for obtaining agricultural information and services in Bangladesh include the Department of Agricultural Extension (DAE), Bangladesh Agricultural National Research Institutes (like BARI, BRRI, BJRI), and the Agricultural Information Service (AIS). These organizations systematically diffuse modern farming technologies from labs to fields.


Additionally, non-governmental organizations (NGOs) like BRAC, local input retailers, community-based farmers' clubs, and progressive model farmers serve as crucial local sources. Digital mediums such as the agricultural call center helpline (16123), dedicated mobile apps, and mass media broadcasts (such as TV and radio agricultural programs) also play a massive role in delivering real-time consultation.","The two types of crops mentioned in the stem are field crops (cultivated on low and medium-low lands) and horticultural crops (cultivated on high lands). Field crops include staples like rice, wheat, and jute, which are grown on a large scale across vast open fields without individual plant-by-plant care.


In contrast, horticultural crops encompass fruits, vegetables, flowers, spices, and plantation crops that require intensive care and are usually grown on well-drained, raised plots with boundary fences. Field crops are typically harvested all at once at maturity and have a longer shelf-life when properly dried, whereas horticultural crops are often harvested in phases and are highly perishable.


Furthermore, the investment and economic return structures differ. Field crops require less intensive labor per unit area and lower initial management costs, whereas horticultural crops demand high initial investments in quality seeds, structural fencing, systematic irrigation, and constant protective operations against pests and environmental changes.","The statement made by Rafiz's uncle, ""The cultivation of horticultural crops is more profitable,"" is highly accurate, logically justified, and reflects the modern economic realities of commercial agriculture.


Firstly, horticultural crops (such as fruits, off-season vegetables, and flowers) command a much higher market price per unit of land compared to traditional field crops like rice or wheat. Since these crops often cater to daily dietary needs, nutritional trends, and urban luxury demands, their market value remains consistently high, allowing smallholders to maximize cash inflows from limited land holdings.


Secondly, horticulture allows for advanced practices like multi-tier cropping, greenhouse farming, and off-season production. Producing vegetables or fruits before or after their natural seasonal peak allows farmers to sell their yield at premium rates when market supply is low, generating exponentially higher profit margins than staple grains that have fixed or controlled pricing.


In conclusion, although horticultural farming involves higher input costs, structural management, and perishability risks, its exceptionally high yield potential and market demand yield a significantly better cost-benefit ratio. Therefore, shifting from subsistence field cropping to high-value horticultural production is a proven strategy for accelerating rural prosperity, making his uncle's assertion entirely correct."
2025,Agriculture 1st Paper,Bangladesh Agriculture and Agricultural Institutions,Dhaka Residential Model College,college,"Naim's father is an experienced farmer. Naim has come with his father to get admitted to Bangladesh Agricultural University. He walks around different places of the agricultural university with his father. There, he is fascinated by seeing seedlings of various types of flowers, fruits, vegetables, and other plants.",NA,Write the names of two agricultural research institutions in Bangladesh.,Explain what 'Farmers Field School' (Krishok Math Skool) is.,How can Naim and his father benefit from the said university?,Explain what contribution Naim's father can make to the agriculture of Bangladesh.,Two prominent agricultural research institutions in Bangladesh are the Bangladesh Agricultural Research Institute (BARI) and the Bangladesh Rice Research Institute (BRRI).,"Farmers Field School' (FFS) is a participatory, field-based training approach where a group of local farmers meet regularly throughout a crop cycle to learn sustainable farming practices directly from hands-on observation. It operates on the principle of ""learning by doing"" rather than conventional classroom lecturing.


The primary goal of this school is to empower farmers to become experts in their own fields. Through FFS, farmers learn advanced topics such as Integrated Pest Management (IPM), soil fertility conservation, balanced fertilizer usage, and climate-smart irrigation. This collective learning process enhances local decision-making and helps reduce reliance on costly chemical inputs.","The university mentioned in the stem is Bangladesh Agricultural University (BAU). Naim and his father can benefit enormously from this pioneer institution across academic, practical, and informational spectrums.


For Naim, the institution provides a world-class academic platform to pursue professional higher education in various specialized fields like Agronomy, Veterinary Science, Fisheries, and Agricultural Engineering. Graduating from here will equip him with the scientific insight and credentials necessary to build a rewarding career as an agricultural officer, researcher, or modern entrepreneur.


For his father, who is an experienced farmer, the university acts as a repository of modern technological innovation. By exploring its research plots, nurseries, and technology extension hubs, he can gain direct access to newly developed high-yielding or stress-tolerant crop seedlings, advanced cattle rearing methodologies, and cost-efficient farm machinery. This direct knowledge transfer will allow him to upgrade his traditional field methods, cut down production costs, and exponentially increase his farm's commercial profitability.","As an experienced farmer who has now gained direct exposure to modern agricultural sciences at Bangladesh Agricultural University, Naim's father can make monumental contributions to the country's agrarian economy at the grassroots level.


1. Adoption and Dissemination of Innovation: By being a progressive cultivator, he can act as a bridge between scientific research and field application. He can set up practical demonstration plots in his village to test new climate-resilient varieties and mechanical harvesters, proving their efficiency to conservative neighbors.


2. Leading Local Knowledge Exchange: Using his extensive practical background combined with newly gathered institutional concepts, he can actively lead local farmer groups or informal community discussions. He can guide fellow smallholders on precise fertilizer ratios, biological pest control, and efficient water conservation, accelerating the modernization of his entire village.


3. Promoting Commercial Diversification: Instead of focusing strictly on traditional low-value grains, Naim's father can pioneer high-value commercial horticulture, advanced fish farming, or integrated dairy operations. This diversification not only maximizes his personal income but inspires a shift toward market-driven agribusiness among nearby communities, boosting rural employment and local food security."