Year,Subject,Chapter,Level,Category,Stem,Stem Image,Question_A,Question_B,Question_C,Question_D,Ans_A,Ans_B,Ans_C,Ans_D
2022,Agriculture 1st Paper,Scope and Importance of Agriculture,Dhaka Board,Board,"The image shows a flowchart of Agricultural Sectors. Under ""Agricultural Sector,"" it branches into: Crop-1 (Rice, Jute, Wheat, Mustard) and Crop-2 (Eggplant, Tomato, Gourd, Guava).","""C:\Users\BMTF\.antigravity\testpaper\Agri1_Ch_Cq_Image\agri1_Ch1_CQ8.png""",What is the Internet?,Why is an experienced farmer important? Explain.,Which field of agriculture does Crop-1 in the chart represent? Explain.,"Between Crop-1 and Crop-2 mentioned in the chart, which one is more profitable to cultivate? Show arguments in favor of your answer.",The Internet is a global network of interconnected computers that allows for the rapid exchange of information and communication worldwide.,"An experienced farmer (pioneer farmer) is crucial because they possess practical, time-tested knowledge of local soil, weather patterns, and traditional farming techniques. They act as a bridge between modern agricultural research and the local farming community, making it easier for others to adopt new technologies.


Their success serves as a living demonstration for other farmers. Because they have faced and overcome various agricultural challenges over the years, their advice is highly trusted, and they play a vital role in ensuring food security at the grassroots level.","Crop-1 in the chart represents the Field Crops (মাঠ ফসল) sector of agriculture. This is evident from the examples provided: rice, jute, wheat, and mustard, which are typically grown on a large scale in open fields.


Field crops are characterized by being grown collectively rather than individually. They are usually seasonal crops that cover vast areas of land and require less intensive individual care per plant compared to horticultural crops. These crops form the staple food supply and provide major industrial raw materials for the country.


In the context of Bangladesh, this sector is the most vital for national food security. Most field crops have a definite growing season and are harvested all at once. They are generally less perishable than horticultural crops, allowing them to be stored and transported over long distances to meet the caloric needs of the entire population.","Between Crop-1 (Field Crops) and Crop-2 (Horticultural Crops), Crop-2 is generally more profitable from a commercial and economic standpoint.


Higher Economic Value: Horticultural crops such as eggplant, tomato, and guava have a much higher market price per unit of production compared to staple field crops like rice or wheat. Since these are often considered high-value nutritional products, they provide a better return on investment for small-scale farmers.


Intensive Land Use: Field crops usually occupy the land for a long duration for a single harvest. In contrast, many horticultural crops have shorter life cycles or can be grown in multi-cropping systems. This allows farmers to utilize the same piece of land multiple times a year, ensuring a continuous flow of income rather than a one-time seasonal payout.


Nutritional and Industrial Demand: There is a constant and growing demand for fresh vegetables and fruits in urban markets. Additionally, these crops are the primary raw materials for the burgeoning food processing industry. Exporting high-quality horticultural products like guava or off-season tomatoes earns significantly more profit and foreign exchange than exporting raw grains.


Conclusion: While Crop-1 is indispensable for basic survival and food security, Crop-2 is the key to economic empowerment and poverty alleviation. For a land-scarce country like Bangladesh, shifting toward high-value horticultural cultivation is a more strategic and profitable approach for improving the socio-economic status of rural farmers."
2022,Agriculture 1st Paper,Agriculture Information and Services,Dhaka Board,Board,"There is a famous agricultural research institute established in 1970 at Joydebpur in Gazipur district. This institute works only with rice crops. The institute is continuing its research activities in developing new varieties of rice, improving cultivation methods, increasing yields, and identifying and controlling harmful insects and pests.",NA,What is a Farmers' Meeting (Krishok Sobha)?,Why is horticultural crop cultivation profitable? Explain.,Explain the activities of the research institute mentioned in the stem.,Analyze the role of the research institute in meeting food demand.,A Farmers' Meeting (Krishok Sobha) is a group-based extension method where a large number of farmers gather at a specific place to receive information on new agricultural technologies or to solve common farming problems.,"Horticultural crop cultivation is highly profitable because these crops, such as fruits, vegetables, and flowers, have a much higher market price per unit of land compared to traditional field crops. They allow for intensive land use and can often be grown year-round.


Additionally, horticultural crops have a high demand in both local and international markets and serve as essential raw materials for the food processing industry. By producing high-value crops on a small piece of land, farmers can ensure a steady cash flow and significantly improve their socio-economic status.","The research institute mentioned in the stem is the Bangladesh Rice Research Institute (BRRI). As described, its primary activities revolve around the scientific development and improvement of rice cultivation in Bangladesh.


Variety Development: BRRI is dedicated to innovating high-yielding (HYV) and stress-tolerant rice varieties (such as those resistant to salinity, drought, or submergence). These varieties are tailored to the different agro-ecological zones of Bangladesh, ensuring that farmers can grow rice even in challenging environments.


Technical and Pest Management: Beyond seeds, the institute develops modern cultivation technologies, including balanced fertilizer recommendations and irrigation techniques. It also conducts extensive research on identifying harmful pests and diseases, providing farmers with integrated pest management (IPM) solutions to protect their yields scientifically.","BRRI plays a monumental role in ensuring the food security of Bangladesh by constantly increasing rice production to match the needs of a growing population. Since rice is the staple food, the institute's contributions are the backbone of the national economy.


Increasing Productivity: Through the release of more than 100 high-yielding varieties, BRRI has enabled farmers to produce significantly more rice from the same amount of land. This ""Green Revolution"" led by research has been the primary reason Bangladesh has moved toward self-sufficiency in food grains despite losing agricultural land to urbanization.


Climate Resilience: In the face of climate change, the institute's role is even more critical. By developing ""Climate Smart"" rice varieties that can survive floods or salty water in coastal areas, they ensure that food production does not collapse during natural disasters, protecting the nation from potential famines.


Nutritional Security and Economic Stability: Modern varieties developed by the institute are not only high-yielding but also bio-fortified with minerals like Zinc. By stabilizing rice prices through consistent supply, the institute helps maintain economic stability, ensuring that even the poorest citizens can afford their daily meals. Therefore, BRRI is indispensable for the country's survival and prosperity."
2022,Agriculture 1st Paper,Agriculture Information and Services,Rajshahi Board,Board,"Seeing a poster that says ""If you want higher yield, apply balanced fertilizer,"" Rahman Mia decided not to use excess fertilizer on his land. He started thinking about the fertilizer application system for his Boro rice field. He asked his friend Rafiq for advice on the amount and timing of fertilizer application. Rafiq Saheb asked him to call the number 7676 from his Banglalink phone to learn about fertilizer management.",NA,What is a Farmers' Field School?,What do you mean by e-Agriculture?,Write the working procedure of the process Rafiq Saheb suggested to his friend for learning about fertilizer management.,What benefits do you think Rahman Mia can get by adopting the mentioned fertilizer management?,"A Farmers' Field School (FFS) is a season-long, field-based training center where 50 male and female farmers receive hands-on education on modern agricultural techniques from the Department of Agricultural Extension.","e-Agriculture is the use of information and communication technology (ICT), such as mobile phones, the internet, and radio, to provide agricultural information and services to farmers. It bridges the gap between scientific knowledge and rural farmers by offering real-time solutions.


Through e-Agriculture, farmers can access weather updates, market prices, and pest control methods instantly. It transforms traditional farming into a precise, technology-driven sector, reducing the need for physical visits to agricultural offices and enabling farmers to make informed decisions for better productivity.","The process suggested by Rafiq Saheb refers to using an Agriculture Call Center (AIS), which is a vital part of e-Agriculture in Bangladesh. The working procedure for obtaining information through this method is direct and user-friendly.


First, the farmer dials the specific shortcode (in this case, 7676 for Banglalink or the universal 16123) from their mobile phone. Once connected, the farmer follows the IVR (Interactive Voice Response) instructions or waits to be connected to an agricultural expert or a customer service representative specialized in farming.


Finally, the farmer describes their specific problem—such as soil type, crop variety, or pest symptoms—to the expert. The expert then provides scientific advice on fertilizer doses, application timing, or pest remedies. This immediate two-way communication allows the farmer to receive expert guidance without leaving the field, ensuring the advice is tailored to their specific needs.","By adopting the mentioned fertilizer management through the call center, Rahman Mia can achieve significant improvements in both his crop yield and his overall economic condition.


Optimal Resource Utilization: Instead of applying fertilizer based on guesswork or traditional habits, Rahman Mia will use a ""Balanced Fertilizer"" dose as advised by experts. This ensures the crop receives exactly what it needs for maximum growth, preventing the waste of expensive fertilizers and reducing the overall cost of production.


Soil Health Preservation: Excessive or unbalanced use of chemicals like Urea can damage the physical and chemical structure of the soil over time. By following scientific management, Rahman Mia will maintain the long-term fertility and productivity of his land, ensuring sustainable yields for future seasons.


Increased Productivity: Proper timing and the right amount of nutrients directly translate to healthier plants and higher grain weight. Since Boro rice is highly responsive to inputs, scientific management will likely lead to a bumper harvest, significantly increasing his total output and profitability.


Conclusion: Beyond just the immediate harvest, this experience will empower Rahman Mia with technical knowledge. It shifts his farming approach from traditional to scientific, making him a more resilient and successful farmer who can handle future agricultural challenges with the help of modern e-Agriculture services."
2022,Agriculture 1st Paper,Soil and Soil Management,Rajshahi Board,Board,"Arman Ali got good yields of field crops on land near his house, but not on land near the riverbank. To make that land more productive, he went to the Upazila Agriculture Officer, who showed him the correct way. The officer advised him to select crops based on the soil texture of his different lands. Following this advice, Arman Ali achieved a good harvest the next year. Seeing his decision, other farmers in the village also got good yields.",NA,What is soil texture?,What is the function of organic matter in soil? Explain.,How did Arman Ali make his mentioned land more suitable for high crop cultivation?,Evaluate the final advice given by the Agriculture Officer.,"Soil texture is the relative proportion of sand, silt, and clay particles present in a given mass of soil.","Organic matter acts as the ""soul"" of the soil, significantly improving its physical, chemical, and biological properties. It increases the soil's water-holding capacity and enhances its aeration, which is vital for root respiration.


Furthermore, organic matter serves as a reservoir of essential plant nutrients and promotes the growth of beneficial microorganisms. It also helps in maintaining a stable soil temperature and buffers the soil against rapid changes in pH, thereby creating an ideal environment for crop growth.","Arman Ali made his riverbank land suitable for higher productivity by shifting from a trial-and-error method to a scientific, ""Soil Texture-Based"" crop selection approach as advised by the Agriculture Officer.


Initially, Arman Ali was likely trying to grow the same field crops on the riverbank as he did near his house. However, riverbank soils are often sandy or have a different texture that may not hold enough water or nutrients for certain crops. By consulting the officer, he identified the specific physical characteristics of that soil.


By matching the crop requirements with the soil's texture—for example, planting crops like watermelon or groundnuts if the soil was sandy, or pulses if it was loamy—he ensured that the plants could thrive in their specific environment. This scientific alignment between soil capability and crop demand was the key to his success.","The Agriculture Officer's final advice—to select crops based on soil texture—is a fundamental principle of modern sustainable agriculture that ensures maximum yield with minimum input waste.


Scientific Accuracy: Soil texture is a permanent physical property that determines a soil's water-holding capacity, nutrient retention, and drainage. By evaluating the texture first, the officer helped Arman Ali identify which crops would naturally thrive on his riverbank land without needing excessive irrigation or chemical intervention.


Economic Viability: Choosing the wrong crop for a specific soil type leads to high production costs and low harvests. The officer's advice saved Arman Ali from financial loss by preventing him from investing in crops that were doomed to fail on riverbank soil. Instead, it guided him toward crops that offered the highest return on investment for that specific land.


Environmental Sustainability: When crops are well-suited to their soil, they require fewer chemical fertilizers and less frequent irrigation. This reduces the risk of nutrient leaching into the river and prevents soil degradation, ensuring that the land remains productive for future generations of farmers in the village.


Social Impact: The success of this advice did not just benefit Arman Ali; it served as a practical demonstration for the entire village. It transformed the traditional mindset of the local farmers into a more technical and scientific one, leading to collective food security and economic growth in the region. Thus, the officer's advice was highly effective and essential."
2019,Agriculture 1st Paper,Soil and Soil Management,Dhaka Board,Board,"Due to the high market price of aromatic rice, farmer Abir from Patuakhali district started cultivating aromatic BR-5 rice on his land with great interest. However, he was disappointed when he did not get the expected yield. Later, he contacted an agricultural officer for advice. After visiting his land and testing the soil, the agricultural officer advised him on careful crop selection and suggested using plenty of organic manure and providing heavy irrigation. Subsequently, he became more profitable by following the advice.",NA,What is agriculture?,At what pH value does soil become alkaline? Explain.,Explain the reason for the low crop production on farmer Abir's land.,Conduct a comparative analysis of Abir's actions in light of the stem.,"Agriculture is a primary production sector that involves the systematic cultivation of land, plants, and the rearing of animals to meet human needs for food, fiber, and other products.","Soil becomes alkaline when its pH value is greater than 7.0. This occurs due to the accumulation of basic salts like calcium, magnesium, and sodium in the soil, which increases the concentration of hydroxyl ($OH^-$) ions.


In alkaline conditions, the availability of essential micronutrients like iron, manganese, and boron decreases, which can hinder plant growth. In the context of Bangladesh, alkaline soils are commonly found in coastal regions where seawater intrusion or low rainfall prevents the leaching of basic salts from the topsoil.","The primary reason for the low crop production on Abir’s land was the unsuitability of the soil (alkalinity/salinity) for the specific variety of rice (BR-5) he chose to cultivate without prior testing. Patuakhali is a coastal district where soil alkalinity and salinity are prevalent issues that directly affect traditional high-yielding varieties.



Aromatic rice varieties like BR-5 are sensitive to soil conditions. If the soil has a high pH or high salt content, it disrupts the osmotic balance of the plants, making it difficult for them to absorb water and essential nutrients. This results in stunted growth and poor grain formation, leading to the disappointment Abir faced despite his hard work.


Furthermore, the lack of organic matter in the soil likely exacerbated the problem. Organic matter helps buffer soil pH and improves water retention. Without it, the harsh chemical properties of the alkaline soil dominated the environment, proving that crop selection based solely on market price without considering soil characteristics is a major cause of agricultural failure.","Abir’s actions can be divided into two distinct phases: his initial traditional approach based on market trends and his subsequent scientific approach based on expert advice. A comparative analysis reveals that the transition from a ""profit-only"" mindset to a ""science-based"" mindset was the turning point for his success.


Traditional vs. Scientific Decision Making: Initially, Abir chose his crop based on ""market price,"" which is a common but risky traditional practice. He ignored the most critical factor—soil suitability. In contrast, his second action involved consulting an agricultural officer and performing a ""soil test,"" which is the cornerstone of scientific farming. This ensured that his subsequent actions were aligned with the land's actual capacity.


Input Management (Organic vs. Chemical): It can be inferred that Abir initially lacked a proper fertilization strategy. However, following the officer's advice, he used ""plenty of organic manure."" Organic manure is essential for coastal alkaline soils as it improves soil structure and neutralizes toxicity. This shift from potentially unbalanced chemical use to organic-heavy management directly improved the biological health of his land.


Environmental Adaptation (Irrigation): The advice for ""heavy irrigation"" was a strategic move to leach out excess salts from the root zone, a technique specifically needed in coastal regions like Patuakhali. Abir’s willingness to adapt his irrigation method showed a move toward ""Precision Agriculture,"" where inputs are tailored to solve specific environmental constraints rather than following a general routine.


Economic Outcome: Abir's initial action led to ""disappointment"" and financial risk, whereas his action following the officer's advice made him ""more profitable."" This proves that in modern agriculture, expert consultation and soil health management are not just technical requirements but are essential economic strategies for sustainable income. His success eventually served as a model for moving away from guesswork toward evidence-based farming."
2019,Agriculture 1st Paper,Agriculture Information and Services,Dhaka Board,Board,Observe the two images below and answer the questions: [Image-A: A group of farmers sitting on the ground for a meeting; Image-B: A farmer in a banana plantation using a laptop].,"""C:\Users\BMTF\.antigravity\testpaper\Agri1_Ch_Cq_Image\agri1_Ch1_CQ13.png""",What is the Internet?,Why are field crops important for Bangladesh? Explain.,What kind of gathering is shown in Image-A of the stem? Explain.,"Between Image-A and Image-B shown in the stem, which one will be more effective in the agricultural sector of Bangladesh? Give arguments in favor of your opinion.","The Internet is a vast, global network of interconnected computers and devices that allows for the rapid sharing of information and communication across the world.","Field crops, such as rice, wheat, and jute, are the backbone of the Bangladeshi economy and food security. They provide the primary source of calories for the population and are essential for achieving self-sufficiency in food production.


Additionally, field crops like jute and sugarcane serve as vital raw materials for domestic industries and are major sources of foreign exchange earnings. Because they can be grown on a large scale across the country's vast plains, they provide employment to the majority of the rural workforce and ensure national stability.","Image-A shows a ""Farmers' Meeting"" (Krishok Sobha) or ""Courtyard Meeting"" (Uthan Boithok), which is a group-based extension method used to disseminate agricultural information at the grassroots level.


In this gathering, a Sub-Assistant Agriculture Officer or an expert sits with a group of local farmers in a familiar environment to discuss seasonal problems and modern techniques. This method is highly effective for building trust and community-level awareness because it allows for direct, face-to-face interaction.


Through these meetings, farmers can immediately clarify their doubts, share their own experiences with peers, and learn about new seeds or fertilizers collectively. It is an informal yet structured way to bridge the gap between agricultural research and the actual practitioners in the field.","In the context of ""Digital Bangladesh"" and the current modernization of the sector, Image-B (e-Agriculture/ICT use) will be more effective in the long run, although both methods have their specific roles.


Speed and Wide Reach: While a physical meeting (Image-A) is limited by time, location, and the number of participants, e-Agriculture (Image-B) can reach millions of farmers instantly. Using laptops or smartphones, farmers can access a global database of information, weather forecasts, and market prices from anywhere at any time.


Precision and Visual Learning: Digital platforms allow farmers to watch high-quality tutorials and use diagnostic apps for pest and disease identification. This provides a level of technical precision that a verbal discussion in a group meeting might lack, helping farmers apply modern scientific solutions accurately in their fields.


Overcoming Logistics and Labor Shortages: As the rural workforce shifts, the ability for a single farmer to use technology to manage large areas or get expert help without waiting for a physical visit from an officer is a game-changer. Digital services like the ""Krishi Batayon"" or call centers provide 24/7 support, which is crucial during emergencies like sudden pest outbreaks or natural disasters.


Conclusion: While group meetings are excellent for social mobilization and building initial trust, the scalability, accuracy, and real-time nature of ICT-based agriculture (Image-B) make it the most powerful tool for transforming Bangladesh into a high-tech, profitable agricultural nation. Investing in digital literacy for farmers is the most effective path toward sustainable food security."
