Year,Subject,Chapter,Level,Category,Stem,Question_A,Question_B,Question_C,Question_D,Ans_A,Ans_B,Ans_C,Ans_D
2023,Business Organization and Management 2nd Paper,Leadership,Sylhet,Board,"Mr. Rupam is the sole proprietor of ""Jaifa Panjabi House"". He manages his employees entirely according to his own whims. He gives no value to the opinions of the employees. Keeping the upcoming Eid-ul-Fitr in mind, he issued a directive to manufacture 1 lakh units of Panjabis. An experienced marketing officer with 15 years of expertise in the relevant field gave an opinion against manufacturing more than 70 thousand pieces considering the market conditions. However, Mr. Rupam remained adamant about manufacturing 1 lakh pieces of Panjabis. After Eid, it was observed that nearly 50 thousand pieces of Panjabis remained unsold. This resulted in heavy losses for the organization.",What is informal leadership?,What is meant by formal leadership? Explain.,"Based on the exercise of authority, what type of leadership is consistent with Mr. Rupam's behavior? Explain.",What type of leadership can save the organization from losses in the future? Give your opinion.,"Informal leadership is a management style where an individual influences and guides others within an organization based on personal relationships, trust, expertise, or charismatic traits, rather than any official corporate designation or formal authority.","Formal leadership refers to a structured management style where a leader derives explicit legal authority and executive power directly from an official organizational hierarchy, rules, policies, and corporate designations.


Under formal leadership, the lines of command and accountability are clearly defined by the institutional framework. The leader holds the official right to guide, instruct, and manage a designated set of subordinates, while the subordinates are structurally obligated to follow those directions to fulfill predefined organizational targets.","Based on the exercise of authority, Mr. Rupam's behavior is consistent with ""Autocratic or Authoritarian Leadership"" (স্বৈরতান্ত্রিক নেতৃত্ব).


Autocratic leadership is a highly centralized management model where the leader concentrates all decision-making authority in their own hands, issues rigid commands, and expects blind compliance from subordinates. An autocratic manager completely disregards the suggestions, feedback, or professional insights of team members, managing the enterprise entirely based on personal whims and top-down command.


According to the file image_e4e3ed.png, Mr. Rupam runs Jaifa Panjabi House entirely according to his own wishes and gives absolutely no value to his employees' opinions. He unilaterally decided to manufacture 1 lakh Panjabis for Eid-ul-Fitr, completely ignoring the realistic market assessment provided by a marketing officer with 15 years of core field experience. This rigid centralization of power and total dismissal of subordinate expertise perfectly aligns with the textbook definition of autocratic leadership.","To save the organization from losses and ensure long-term stability, Mr. Rupam must adopt ""Democratic or Participative Leadership"" (গণতান্ত্রিক বা অংশগ্রহণমূলক নেতৃত্ব).


Democratic leadership is an inclusive management approach where the leader shares decision-making power by actively seeking suggestions, encouraging consultations, and valuing the specialized expertise of subordinates before finalizing action plans. In commercial enterprises, this inclusive approach allows executives to utilize the practical field knowledge of senior employees, minimizing operational miscalculations, avoiding heavy inventory wastage, and aligning corporate strategies with actual market realities.


As displayed in the file image_e4e3ed.png, Mr. Rupam's autocratic decision to manufacture 1 lakh units severely backfired because he refused to listen to his 15-year experienced marketing officer, who advised a safer cap of 70 thousand units. By acting in isolation, Mr. Rupam misjudged the actual consumer demand, leaving nearly 50 thousand Panjabis unsold and plunging his retail house into heavy financial losses. Transitioning to a democratic system will directly prevent such structural errors in the future.


Therefore, it is my firm opinion that democratic leadership is highly essential for the survival of the business. By establishing a collaborative environment where sales forecasts and production numbers are debated and evaluated with experienced professionals, Mr. Rupam can make realistic, data-driven decisions. This participatory framework will eliminate blind stock manipulation, safeguard the firm against catastrophic inventory surpluses, and turn operational workflows back into sustainable commercial prosperity."
2023,Business Organization and Management 2nd Paper,Leadership,Sylhet,Board,"Mr. Shafiq is the managing director of a manufacturing organization. Before making organizational decisions, he discusses and consults with his subordinates and then provides directions. On the other hand, Mr. Rafiq does not take anyone's advice for decision-making unless it is absolutely necessary. However, he gets work done by the workers through affection and care. The reputation of their organization is increasing day by day.",What is laissez-faire leadership?,"""A leader must have the ability to take risks""—Explain.",What type of direction does Mr. Shafiq provide in the stem? Explain.,What type of leadership is playing a role behind the success of Mr. Rafiq's organization? Explain.,"Laissez-faire (free-rein) leadership is a management style where the leader completely abdicates executive authority, grants full operational autonomy to subordinates, and refrains from active supervision or decision-making after merely assigning goals.","The statement ""A leader must have the ability to take risks"" means that an effective manager must possess the psychological courage and strategic foresight to make critical decisions under conditions of uncertainty.


Business environments are constantly changing due to shifting market trends, technological upgrades, and intense competition. If a leader is completely risk-averse, the organization becomes stagnant and fails to capitalize on new commercial opportunities. Therefore, the capacity to accept calculated risks is vital for driving innovation, expanding operations, and ensuring long-term institutional growth.","In the stem, Mr. Shafiq provides ""Consultative Direction"" (পরামর্শমূলক নির্দেশনা) in his organization.


Consultative direction is a modern, employee-centric management approach where a supervisor actively discusses operational plans, shares conceptual insights, and seeks opinions from subordinates before finalizing and issuing formal orders. By involving the workforce in the decision-making loop, this style satisfies the employees' psychological need for respect, eliminates internal resistance, and builds high workplace morale.


According to the file image_e4e46f.png, Mr. Shafiq does not execute decisions in isolation. Before reaching institutional determinations, he systematically sits down with his subordinates to discuss and consult on the relevant matters, and then issues executive directives. Because his supervisory methodology relies firmly on bidirectional communication, mutual respect, and collaborative consensus rather than arbitrary force, it perfectly matches the textbook definition of consultative direction.","The type of leadership playing a role behind the success of Mr. Rafiq's organization is ""Paternalistic Leadership"" (পিতৃসুলভ নেতৃত্ব).


Paternalistic leadership is an offshoot or refined form of autocratic leadership where the manager acts as a protective, parental figure to the subordinates. Although the leader maintains centralized command and retains all ultimate decision-making power without consulting the workforce, they treat employees like family members. The leader guides them with deep care, affection, and empathy, which motivates workers to perform exceptionally well out of loyalty and respect rather than fear.


As displayed in the stem, Mr. Rafiq holds absolute decision-making power and explicitly avoids taking advice or consultations from anyone unless an extraordinary situation arises. However, instead of being a harsh or dictatorial manager, he extracts high productivity from his workers through affection, empathy, and deep care. This nurturing, family-like administrative behavior satisfies the emotional needs of the workforce, inspiring high dedication and directly driving the continuous growth of the company's institutional reputation. Therefore, it can be firmly analyzed that his paternalistic leadership style is the primary driver of success in his enterprise."
2023,Business Organization and Management 2nd Paper,Leadership,Barisal,Board,"Abdullah Al Noman is an assistant manager of a rubber plantation. He harbors a negative perception regarding the workers and employees, which has impacted them. Their enthusiasm has decreased. As a result, the production of rubber decreased last year.",What is supervision?,Why must a leader be farsighted? Explain.,"Based on the nature of power, what type of leader is Mr. Abdullah Al Noman? Explain.",What should be done to overcome the current situation in the organization of the stem? Give your opinion.,"Supervision is the managerial act of overseeing, monitoring, and guiding subordinates while they perform their assigned tasks to ensure work is being executed correctly according to plans and instructions.","A leader must be farsighted because leadership requires the strategic ability to anticipate future market trends, potential operational hazards, and economic changes well in advance.


Business environments are dynamic and filled with uncertainties. A farsighted leader can visualize upcoming challenges or opportunities, allowing the organization to formulate proactive plans and make timely adjustments rather than reacting blindly to crises, which ensures long-term institutional stability and competitive survival.","Based on the nature and application of power, Mr. Abdullah Al Noman exhibits the traits of an ""Autocratic / Authoritarian Leader"" (স্বৈরতান্ত্রিক নেতা), heavily influenced by ""Theory X"" (নেতিবাচক বা 'এক্স' তত্ত্ব) assumptions.


In management literature, leaders who maintain a inherently negative perception of their workforce believe that employees are naturally lazy, dislike work, avoid responsibility, and must be strictly monitored or coerced to perform. This viewpoint directly shapes an autocratic leadership style, where authority is tightly centralized, communication is strictly top-down, and the manager relies on fear, tight supervision, or systemic pressure rather than mutual trust and collaboration.


According to the file image_e4e80e.png, Mr. Noman holds a deep-seated negative perception toward the workers and employees at the rubber plantation. Instead of motivating them, his pessimistic attitude and rigid approach negatively impacted the workforce, stripping them of their workplace enthusiasm and causing operational morale to collapse. Because his administrative behavior is anchored entirely in negative assumptions and centralized command rather than supportive guidance, it perfectly fits the structural profile of autocratic leadership based on power exercise.","To overcome the current crisis and restore production efficiency, the plantation management must immediately shift toward ""Positive Leadership"" (ইতিবাচক নেতৃত্ব) and adopt a ""Democratic or Participative"" (গণতান্ত্রিক বা অংশগ্রহণমূলক) framework.


When productivity declines due to low morale and manager-employee friction, continuing an authoritarian or negative approach will only worsen organizational failure. Positive leadership focuses on lifting employee morale through financial and non-financial incentives, respectful communication, and human recognition. Pairing this with a democratic style allows management to consult workers, value their field inputs, and make them feel like integral assets of the enterprise, which converts mechanical compliance into spontaneous work dedication.


As displayed in the file image_e4e80e.png, Mr. Noman's negative mindset directly caused a severe drop in worker enthusiasm, which dragged down the rubber plantation's output last year. To reverse this damage, the following strategic steps should be taken:


1. Change the Leadership Approach: The management must abandon fear-based, pessimistic oversight (Theory X) and engage with workers using empathy, appreciation, and care (Theory Y).

2. Introduce Consultative Practices: Before assigning routine plantation targets, managers should sit with field supervisors and workers to discuss realistic goals, eliminating psychological alienation.

3. Deploy Motivational Incentives: Implementing performance bonuses, fair working conditions, or public praise will directly re-ignite the workers' lost enthusiasm.


Therefore, it can be firmly concluded that transforming the workplace atmosphere through supportive, positive leadership is the only effective way forward. By restoring mutual trust and boosting employee morale, the organization can successfully eliminate negligence, maximize field productivity, and turn the rubber plantation's declining yields back into sustainable commercial growth."
2022,Business 2nd Paper,Leadership,Dhaka,Board,"Mr. Rafsan, the manager of RNL Ballpen Ltd., does not have faith in the capabilities of his organization's employees and does not take advice from them for decision-making. Although this results in swift execution of organizational work, the workers are not satisfied. On the other hand, Bichitra Sen, the head of BSB Company, does not give any advice or intervention regarding the workers' tasks; the workers themselves make the decisions.",What is a budget?,When is negative leadership necessary? Explain.,"Based on the application of power, what type of leadership does Mr. Rafsan follow? Explain.","""Although the leadership style followed by Mr. Bichitra Sen of BSB Company plays a special role in developing creativity, it is not a very effective method for maintaining team cohesion""—Do you agree? Give reasons.",A budget is the numerical or quantitative expression of a plan compiled for a specific future period.,"Negative leadership is a management approach where a leader influences subordinates to perform tasks through fear, intimidation, penalties, and threat of punishment rather than positive incentives.


This type of leadership becomes necessary when dealing with uneducated, highly undisciplined, or habitually lazy workers who deliberately avoid their duties. In severe crises where quick task execution is required and workers refuse to cooperate under normal conditions, enforcing negative pressure ensures the basic survival and immediate behavioral compliance of the workforce.","In the stem, Mr. Rafsan follows ""Autocratic or Authoritarian Leadership"" (স্বৈরতান্ত্রিক নেতৃত্ব) based on the application of his managerial power.


Autocratic leadership is a centralized management model where the leader concentrates all decision-making authority in their own hands, issues rigid orders, and demands strict compliance from subordinates without seeking their input. An autocratic manager lacks faith in employee capabilities, maintains total distance from the workforce, and relies heavily on formal authority to drive task execution, prioritizing quick results over employee satisfaction.


According to the file image_e4eb8f.png, Mr. Rafsan explicitly does not trust the abilities of his staff at RNL Ballpen Ltd. and strictly avoids taking any advice from them during decision-making loops. While this extreme concentration of power allows him to execute institutional tasks very swiftly, it completely isolates the employees and leaves them highly dissatisfied. Because his execution methods rely entirely on centralized top-down command and absolute disregard for employee participation, it perfectly represents the textbook profile of autocratic leadership.","Yes, I entirely agree with the statement. Mr. Bichitra Sen follows ""Laissez-faire or Free-rein Leadership"" (লাগামহীন বা মুক্ত নেতৃত্ব), which boosts individual creativity but severely weakens team cohesion.


Laissez-faire leadership is an open style where the leader completely detaches themselves from daily management, abdicates decision-making power, and gives full autonomy to subordinates. This approach is highly effective for fostering personal creativity because employees enjoy absolute professional freedom, allowing them to experiment with innovative solutions, think independently, and develop unique strategic designs without any fear of managerial intervention or overbearing supervision.


As displayed in the file image_e4eb8f.png, Mr. Bichitra Sen leaves his workers completely to themselves, allowing them to make all structural decisions independently. While this environment gives BSB Company's workforce the freedom to enhance their individual creative capacities, it naturally backfires when trying to preserve collective team unity. Because there is no active central authority to guide, mediate, or coordinate tasks, a severe management vacuum forms. Workers begin operating completely in isolation, which inevitably leads to severe internal conflicts, lack of alignment, and structural chaos within the firm.


Therefore, it can be firmly analyzed that while free-rein leadership acts as a catalyst for individual ingenuity, it is an ineffective method for maintaining team cohesion. Without a strong leader to harmonize individual goals, coordinate cross-functional efforts, and enforce shared accountability, the organizational parts fall apart. To maintain operational stability alongside creative growth, an enterprise must shift away from complete non-intervention and implement a balanced, consultative framework that preserves both team discipline and individual innovation."
2022,Business 2nd Paper,Leadership,Dhaka,Board,"""Shopner Thikana Ltd."" is a t-shirt manufacturing company. They have a good reputation for producing high-quality t-shirts. In the current year, the company increased its production target and set it at seven lakh units. But in six months, only three lakh units of t-shirts have been manufactured. Under these circumstances, the company increased its supervision, identified the faults and deviations, and took corrective measures. They hope to achieve the target within the specified time.",What is the basis of control?,"""Control is a continuous process""—Explain.",Which step of control did Shopner Thikana Ltd. follow first? Explain.,Do you think Shopner Thikana Ltd. will be successful due to the measures taken in the changed circumstances? Give your opinion.,A plan is the primary basis of control.,"""Control is a continuous process"" means that control is not a one-time or final activity in management; rather, it is a cyclical, ongoing task that must be performed regularly alongside operational workflows.


As long as organizational activities exist, management must consistently establish performance standards, evaluate actual performance against those standards, identify deviations, and implement corrective measures. Once corrective actions are taken, new plans are formulated, and the controlling process starts anew, making it a never-ending cycle within the administrative framework.","In the stem, Shopner Thikana Ltd. first followed the step of ""Establishing Performance Standards"" (আদর্শমান নির্ধারণ) within the controlling process.


The controlling function consists of several sequential stages, the very first of which is setting up clear, measurable targets or criteria known as performance standards against which final results can be evaluated. Without pre-determining a specific standard or quantitative goal at the beginning of an operational cycle, it is completely impossible for an organization to measure actual performance or identify any operational errors later on.


According to the file image_e4ec2f.png, Shopner Thikana Ltd. formally established a clear production benchmark for the current year by setting a quantitative target of manufacturing seven lakh units of t-shirts. This explicit production figure served as the foundational baseline for their entire operational timeline, allowing them to evaluate their half-yearly output of three lakh units. Since setting this definitive target of seven lakh units was their initial administrative step to guide and measure performance, it perfectly matches the textbook definition of establishing performance standards.","Yes, I firmly believe that Shopner Thikana Ltd. will be successful in achieving its targeted goals within the specified time due to the corrective measures taken under the changed circumstances.


In management, the ultimate objective of control is not merely to detect errors but to execute ""Taking Corrective Action"" (সংশোধনমূলক ব্যবস্থা গ্রহণ), which ensures that operational performance is brought back into alignment with original plans. When mid-term deviations are identified, an effective management system immediately increases supervisory oversight, identifies root causes of bottlenecks, and deploys practical remedies to ensure future workflows proceed without disruption, thereby safeguarding the organization from final failure.


As displayed in the file image_e4ec2f.png, Shopner Thikana Ltd. experienced an unexpected deficit, manufacturing only three lakh t-shirts in the first six months against their proportional expectations. However, instead of remaining passive, the enterprise proactively modified its administrative approach by tightening supervision, evaluating systemic flaws, and actively introducing corrective measures to eliminate the noted operational deviations. By realigning their active production methods midway through the year, they have effectively optimized their factory efficiency to cover the shortfall.


Therefore, it can be analyzed that the timely deployment of controlling functions is highly rational and realistic. Implementing strong corrective actions eliminates production negligence, improves resource allocation, and accelerates output speed for the remaining period. This proactive structural adjustment firmly guarantees that the apparel firm will overcome its half-yearly setback, minimize operational risks, and successfully achieve its total production target of seven lakh units before the annual deadline."
