Year,Subject,Chapter,Level,Category,Stem,Question_A,Question_B,Question_C,Question_D,Ans_A,Ans_B,Ans_C,Ans_D
2025,Business Organization and Management 2nd Paper,Leadership,Dhaka,Board,"Mr. Humayun Kabir, the Managing Director of 'Unique Industries', is a gentle person. He keeps trust in employees regarding work execution. He takes employees' opinions when making important decisions for the organization. As the employees have a positive perception of the authority, the organization has been achieving rapid success. Due to Mr. Humayun Kabir's sudden illness, his son Mr. Mahim Kabir takes over the responsibility of Managing Director. He takes important decisions of the organization completely alone. As Mr. Mahim Kabir runs the organization with sole leadership, it faces losses within a few days.",What is employee-centered leadership?,Why does a leader need to be patient? Explain.,Through what type of leadership did Mr. Humayun Kabir run the organization in the stem? Explain.,Do you think the organization faced losses due to Mr. Mahim Kabir's leadership? Give your opinion.,"Employee-centered leadership is a style where the leader emphasizes human relationships, values the well-being, feelings, and growth of subordinates, and treats them with respect.","A leader needs to be patient because managing diverse human behaviors and navigating unexpected institutional crises require high emotional stability and endurance.


In an organizational setup, subordinates may make mistakes, show resistance to change, or experience low morale, which a leader cannot fix through anger or hasty reactions. By exercising patience, a leader can carefully analyze complex problems, listen to employee grievances, and make well-thought-out, strategic decisions that preserve internal harmony and prevent chaotic organizational failures.","In the stem, Mr. Humayun Kabir ran the organization through ""Democratic Leadership"" (গণতান্ত্রিক বা অংশগ্রহণমূলক নেতৃত্ব).


Democratic leadership is a management style where the leader does not make operational choices alone; instead, they consult with subordinates, seek their valuable opinions, and allow them to participate actively in the decision-making process. This leadership fosters mutual trust, enhances employee satisfaction, and creates a highly collaborative, positive working environment where workers feel valued as integral assets.


According to the stem, Mr. Humayun Kabir is a gentle leader who places immense faith in his employees' execution capabilities. Whenever critical decisions need to be taken for Unique Industries, he explicitly takes the opinions and feedback of his workforce. This open and participative method built a strong, positive perception among the employees toward the management, directly leading the organization to rapid and consistent operational success.","Yes, I fully agree with the statement that the organization faced financial losses precisely because of the negative impacts of Mr. Mahim Kabir's ""Autocratic Leadership"" (স্বৈরতান্ত্রিক নেতৃত্ব) style.


Autocratic leadership is a style where the leader centralizes all decision-making power and authority within themselves, ignoring the ideas, experiences, or feedback of subordinates. Under this system, employees are expected to follow orders blindly, which severely damages workplace morale, creates a communicative distance between management and staff, and inevitably leads to operational inefficiency and institutional regression.


The stem clearly illustrates that upon taking over due to his father's sudden illness, Mr. Mahim Kabir abandoned the participatory approach. He began making vital corporate decisions completely alone, establishing absolute centralized control. By operating under this rigid sole leadership, he completely disconnected the operational realities of the workers from executive strategy, which rapidly caused the firm to suffer financial losses.


Therefore, it can be concluded that the sudden structural shift from a supportive democratic culture to a closed autocratic model is the primary reason behind the decline of Unique Industries. Mr. Mahim Kabir's failure to engage his experienced team and his insistence on centralized decision-making directly dismantled the firm's competitive edge, pushing it into financial failure."
2025,Business Organization and Management 2nd Paper,Leadership,Rajshahi,Board,"Mr. Maruf is the General Manager of a company. He does not take any opinions from the subordinates of the organization for any work. He only does what he considers best himself. Because of this, dissatisfaction appears among the subordinates and the profit of the company decreases. Later, to ensure the spontaneous participation of the subordinates, he started taking their opinions in all tasks. As a result, the expected profit of the organization is achieved.",What is supervision?,Why does a leader need to be patient? Explain.,What type of leadership did Mr. Maruf follow in the stem? Explain.,"""The method of direction followed by Mr. Maruf is the reason for achieving expected profits in his organization""—Analyze in the light of the stem.","Supervision is the administrative act of overseeing, guiding, and monitoring the work of subordinates on the spot to ensure they execute tasks correctly.","A leader needs to be patient because managing human behavior and overcoming operational challenges require high emotional control and endurance.


In any enterprise, subordinates have varying capacities, make errors, or may initial resist changes, none of which can be effectively managed through anger or hasty actions. By remaining patient, a leader can thoughtfully evaluate problems, understand underlying employee grievances, and implement rational strategies that build long-term corporate harmony and ensure smooth business operations.","In the stem, Mr. Maruf initially followed an ""Autocratic Leadership"" (স্বৈরতান্ত্রিক নেতৃত্ব) style.


Autocratic leadership is a style where all decision-making authority is completely centralized in the hands of the leader, who imposes their own choices without taking any advice or feedback from subordinates. This management style neglects human relationships, treats employees like machines, and heavily induces job dissatisfaction, which ultimately reduces overall organizational performance and profitability.


According to the stem, Mr. Maruf did not seek or accept opinions from his subordinates for any work, carrying out tasks solely based on his personal wishes. This absolute centralized control caused widespread resentment among his workforce and directly dragged down the company's profitability. This behavior perfectly aligns with the characteristics of autocratic leadership.","The statement refers to the ""Consultative Direction"" (পরামর্শমূলক নির্দেশনা) method adopted later by Mr. Maruf, which is indeed the core driver behind achieving the expected corporate profits.


Consultative direction is a modern, employee-oriented directing technique where a supervisor discusses issues and consults with subordinates before issuing final instructions. By seeking opinions and engaging the team, this method blends leadership direction with democratic principles, making employees feel highly valued, structurally responsible, and deeply committed to achieving execution targets.


The stem clearly shows that when the initial autocratic approach failed, Mr. Maruf strategically changed his direction methodology. To ensure spontaneous worker participation, he actively began taking their opinions and valuable feedback into consideration for all tasks. This supportive shift completely eliminated workforce dissatisfaction, boosted execution speed, and directly resulted in securing the expected organizational profits.


Therefore, it can be concluded that the transition to consultative direction was the turning point for the firm. By transforming simple orders into collaborative actions, Mr. Maruf energized his human resources, proving that consultative direction is an exceptional mechanism to drive high operational efficiency and financial success."
2025,Business Organization and Management 2nd Paper,Leadership,Rajshahi,Board,"Mr. Akash consults with the implementing officers and employees before making decisions in his organization. At the beginning of the year, Mr. Akash collected and analyzed various data and imported an additional 50 tons of raw materials for higher production. Currently, the price of raw materials in the market has doubled, and as a result, Mr. Akash's organization has benefited greatly.",Who is a leader?,Direction always flows downward—Explain.,What is the leadership style of Mr. Akash's organization in the stem? Explain.,"Evaluate the justification, in the light of the stem, of the special quality of an ideal leader that played a role behind Mr. Akash's success.","A leader is an individual who guides, directs, influences, and inspires a group of people or subordinates to work willingly toward achieving a common objective.","Direction always flows downward because instructions, orders, and guidance naturally originate from higher-level management and travel down the organizational hierarchy to lower-level executives or workers.


In a structured management system, top-level managers hold the primary decision-making power and strategic vision. They convert these goals into clear directives, operational plans, and rules, which are then passed down sequentially to middle and lower management for execution. Subordinates lack the authority to issue orders to their superiors, making direction a strictly downward, vertical flow of administrative communication.","In the stem, Mr. Akash's organization exhibits a ""Democratic Leadership"" (গণতান্ত্রিক বা অংশগ্রহণমূলক নেতৃত্ব) style.


Democratic leadership is an inclusive management style where the leader does not impose decisions unilaterally. Instead, the leader actively discusses plans, seeks constructive feedback, and values the opinions and suggestions of subordinates before formalizing any strategic decision. This approach creates an environment of shared responsibility, strengthens trust, and significantly enhances the motivation of employees to execute the decision effectively.


According to the stem, Mr. Akash always consults directly with the implementing officers and employees before finalising any decision in his firm. Rather than operating in isolation, he includes his team in the decision-making process. This cooperative mindset of acknowledging his subordinates' perspectives perfectly mirrors the fundamental attributes of democratic leadership.","The special quality of an ideal leader that played a crucial role behind Mr. Akash's immense financial success is ""Foresight"" or Far-sightedness (দূরদর্শিতা).


Foresight is the mental capacity of a leader to anticipate future trends, opportunities, changes, and risks by meticulously analyzing current market data and past patterns. In the business world, economic conditions fluctuate constantly, and a leader possessing great foresight can take proactive, timely steps that insulate the organization from crises or capture high-profit margins before competitors can react.


The stem highlights that at the very beginning of the year, Mr. Akash spent time collecting and analyzing various data to make an strategic calculation. Based on his analytical findings, he anticipated future demand and took the calculated risk to import an extra 50 tons of raw materials. When raw material prices unexpectedly doubled in the open market later on, his pre-purchased inventory saved the firm from soaring operational costs, resulting in massive profitability.


Therefore, it is highly justified to conclude that Mr. Akash's foresight was the catalyst for his success. His ability to look ahead, read market indicators, and make an accurate, data-driven advance purchase demonstrates that strategic foresight is an indispensable quality for an ideal leader to navigate economic uncertainties and ensure corporate growth."
2025,Business Organization and Management 2nd Paper,Leadership,Jessore,Board,"Mr. Akash consults with officers and employees of all levels before making decisions in his factory. This creates a positive perception among the workers toward the administration. As a result, production in the organization is continuously increasing. On the other hand, Mr. Sagar does not take any employee's advice when making decisions in his factory. He makes decisions completely alone and forces everyone to implement them. This increases workers' dissatisfaction toward the administration, and production is continuously decreasing.",What is leadership?,What is meant by 'laissez-faire leadership'? Explain.,What type of leadership has Mr. Akash provided in the organization in the stem? Explain.,Mr. Sagar's type of leadership can damage the organization—Evaluate appropriately in the light of the stem.,"Leadership is the process of guiding, influencing, and inspiring subordinates to work spontaneously and enthusiastically toward achieving organizational goals.","Laissez-faire (free-rein) leadership refers to a style where the leader gives complete decision-making freedom to subordinates and entirely avoids exercising direct executive control.


Under this style, the leader does not issue formal orders, guide daily tasks, or hold accountability, leaving employees to set their own goals and solve problems independently. While it offers maximum autonomy, it often leads to organizational chaos, a lack of discipline, and a loss of direction unless the subordinates are highly skilled, self-motivated professionals.","In the stem, Mr. Akash has provided ""Democratic Leadership"" (গণতান্ত্রিক বা অংশগ্রহণমূলক নেতৃত্ব) in his organization.


Democratic leadership is an inclusive management approach where the leader values human capital, shares decision-making authority, and actively seeks advice, feedback, and suggestions from subordinates before finalizing any operational strategy. This dynamic style builds deep mutual trust, strengthens corporate communication, and elevates the emotional commitment of the workforce to execute decisions flawlessly.


According to the stem, Mr. Akash does not make unilateral choices; he systematically consults with officers and employees across all levels of his factory before implementing policies. This participative approach successfully fostered a highly positive perception among the workers toward the company's administration. Because the workforce felt fundamentally respected and integrated into executive planning, factory production began increasing continuously, satisfying the textbook criteria of democratic leadership.","Yes, the statement is highly accurate; Mr. Sagar's ""Autocratic Leadership"" (স্বৈরতান্ত্রিক নেতৃত্ব) style severely damages organizational stability, dampens human productivity, and can ultimately lead to business failure.


Autocratic leadership is a centralized, rigid style where the leader retains absolute authority, makes critical corporate decisions entirely in isolation, and relies heavily on fear, command, or force to ensure compliance. Subordinates are completely denied a voice in decision-making, which systematically destroys workplace morale, breeds deep organizational resentment, and alienates the workforce from the company's mission.


The stem clearly shows that Mr. Sagar completely ignores his employees' insights, designs policies entirely by himself, and aggressively forces his workers to execute those commands. This severe communicative distance directly amplified worker dissatisfaction toward the factory administration. Because the employees feel treated like mechanical tools rather than human assets, their motivation collapsed, triggering a continuous decline in factory production metrics.


Therefore, it can be concluded that maintaining such an authoritarian environment poses a significant threat to the enterprise. Persistent production drops and a disgruntled workforce inevitably lead to massive financial losses, proving that Mr. Sagar's autocratic style is fundamentally damaging to the long-term viability of the organization."
2025,Business Organization and Management 2nd Paper,Leadership,Jessore,Board,"Mr. Rofiq is a fish farmer. He seeks advice from the workers employed in his enterprise regarding fish farming determinants such as fish fry, feed, pond management, medicine, security, etc., and provides them with directions to perform tasks accordingly. On the other hand, a businessman of the same nature, Mr. Shofiq, believes that his workers are less educated, and taking advice from them is nothing but a waste of time. He makes all decisions alone and directs the workers to follow them.",What is democratic leadership?,Why is direction called the heartbeat of administration? Explain.,What kind of direction does Mr. Rofiq provide in the stem? Explain.,"Between the leadership styles of Mr. Rofiq and Mr. Shofiq, which one is better and why? Analyze.","Democratic leadership is a management style where the leader makes decisions by consulting with subordinates, seeking their opinions, and encouraging their active participation.","Direction is called the heartbeat of administration because it initiates, guides, and keeps all organizational activities alive, just like the heart keeps a body functional.


In management, even the most meticulous planning, organized structure, and qualified human resources remain completely inactive until direction is issued. It transforms thoughts into actions by commanding, guiding, and motivating employees to execute their duties. Without continuous and dynamic direction, the entire administrative machinery falls silent and comes to a complete standstill, making it the vital life force of an enterprise.","In the stem, Mr. Rofiq provides ""Consultative Direction"" (পরামর্শমূলক নির্দেশনা) to his workforce.


Consultative direction is an modern, employee-centered directing technique where a supervisor actively discusses issues, exchanges ideas, and seeks opinions from subordinates before issuing final orders or guidelines. This process makes the execution of orders much smoother because the implementing workers feel valued and have already contributed their practical insights to the plan.


According to the file image_da024b.png, Mr. Rofiq sits with his fish farm employees to take their valuable suggestions on critical operational elements like fish fry selection, feed quality, pond management, and security protocols. He only issues final tasks and work instructions after adjusting his plans based on their operational feedback. This collaborative directing mechanism directly corresponds to consultative direction.","Between the two styles, Mr. Rofiq's leadership style (Democratic/Participative Leadership) is far better than Mr. Shofiq's style (Autocratic Leadership).


Democratic leadership encourages two-way communication, respects human capital, and relies on mutual trust to achieve targets. On the contrary, autocratic leadership centralizes all authority, relies on a one-way command structure, treats workers like mechanical tools, and considers employee input to be completely useless.


Mr. Rofiq’s inclusive method leverages the practical, on-the-ground experience of his farmhands, which improves decision quality and boosts employee morale, making them work spontaneously. Conversely, Mr. Shofiq's authoritarian assumption that his less-educated staff have nothing to offer fosters workplace alienation, drops execution accuracy, and breeds hidden resentment among the workforce.


Therefore, it can be concluded that Mr. Rofiq's participative approach is distinctly superior. In modern business management, engaging workers—even in manual labor sectors like fish farming—creates high emotional commitment, eliminates administrative distance, and ensures long-term operational productivity, whereas rigid autocracy leads to systematic failure."
2025,Business Organization and Management 2nd Paper,Leadership,Comilla,Board,Hasan Ali is a manager of an organization. He conducts operations based on the opinions of his subordinates. His relationship with the subordinates is very good. Hasan Ali's organization is prospering day by day.,What is leadership?,What is meant by democratic leadership? Explain.,"Based on the exercise of power, what type of leadership is present in Hasan Ali's organization? Explain.",Analyze the reasons behind the economic prosperity of Hasan Ali's organization.,"Leadership is the managerial process of guiding, influencing, and inspiring subordinates to work willingly and enthusiastically toward the achievement of organizational goals.","Democratic leadership refers to an inclusive leadership style where the leader shares decision-making authority with subordinates and encourages their active participation.


Under this style, the leader seeks the opinions, advice, and creative feedback of the workforce before making final decisions, promoting open communication. This approach significantly boosts employee morale, builds strong mutual trust, and establishes an optimal corporate environment where workers feel valued, leading to high dedication and organizational efficiency.","Based on the exercise of power, ""Democratic Leadership"" (গণতান্ত্রিক বা অংশগ্রহণমূলক নেতৃত্ব) is present in Hasan Ali's organization.


On the basis of power exercise, leadership is classified into styles like autocratic, democratic, and laissez-faire. Democratic leadership stands out because the leader does not centralize power or issue commands unilaterally; instead, they explicitly utilize their power to create a consultative ecosystem where subordinates are actively engaged in determining operational pathways.


According to the file image_da0302.png, Hasan Ali behaves as an ideal participatory manager by conducting his firm's daily operations strictly based on the consensus and opinions of his subordinates. He actively values their viewpoints rather than imposing dictatorial rule, which fosters an outstanding, collaborative working relationship between management and the general staff. This respectful distribution of decision-making input perfectly reflects the core principles of democratic leadership.","The primary reason behind the economic prosperity of Hasan Ali's organization is the strategic implementation of democratic leadership, which maximizes workforce productivity and structural efficiency.


When an organization adopts a democratic management model, it effectively bridges the communicative gap between the executive level and the operational team. By involving employees in planning, the company gains access to valuable, practical on-the-ground insights while simultaneously instilling a powerful sense of institutional ownership and responsibility within the workforce.


In the stem, we observe that Hasan Ali manages his enterprise by explicitly incorporating his subordinates' opinions into the core decision-making loop. This inclusive approach directly created an exceptionally harmonious employer-employee relationship, eliminating internal conflicts and workplace resistance. When workers feel psychologically secure, respected, and directly credited for institutional strategies, their performance reaches its peak, resulting in minimal resource wastage and optimized operational workflows.


Therefore, it can be concluded that this heightened level of employee dedication and streamlined productivity is the catalyst for the firm's financial growth. The continuous, steady economic improvement seen in Hasan Ali's company proves that a supportive, democratic environment directly drives superior operational performance, which ultimately translates into outstanding commercial success and rapid organizational prosperity."
