Year,Subject,Chapter,Level,Category,Stem,Question_A,Question_B,Question_C,Question_D,Ans_A,Ans_B,Ans_C,Ans_D
2023,Business Organization and Management 2nd Paper,Leadership,Mymensingh,Board,"Mrs. Sumi is the chief executive of an organization. Before making any decision, she discusses and consults with workers of all levels and takes decisions accordingly. She provides directions based on that. This makes the workers delighted. But Mrs. Sumi's strategies are not working well lately. Competitor organizations are using similar strategies like her organization. Due to this, she is worried.",What is leadership?,"""Workers are inspired by positive leadership""—Explain.",What type of direction is followed by Mrs. Sumi? Explain.,For which problem of direction are Mrs. Sumi's strategies not working? Give your opinion.,"Leadership is the managerial process of guiding, influencing, and inspiring a group of subordinates to work willingly, enthusiastically, and cooperatively toward achieving specific organizational goals.","The statement ""Workers are inspired by positive leadership"" means that when a leader motivates employees using rewards, recognition, praise, and financial or non-financial incentives, it elevates their mental drive and work enthusiasm.


Positive leadership focuses on encouraging employees rather than creating fear or relying on punitive measures. When workers feel structurally supported, valued, and safe under such a leadership model, their self-confidence increases, which naturally inspires them to maximize their productivity and willingly dedicate their best efforts to reach corporate targets.","Mrs. Sumi follows ""Consultative Direction"" (পরামর্শমূলক নির্দেশনা) in her organization.


Consultative direction is a modern, participative style of management where a supervisor discusses operational tasks, shares insights, and actively seeks suggestions from subordinates before finalizing policies and issuing formal orders. By bringing the workforce into the decision-making loop, this employee-centric approach satisfies their psychological need for respect, eliminates internal execution resistance, and creates high job satisfaction.


According to the file image_e4d90c.png, Mrs. Sumi does not act as an isolated or rigid manager. Instead, prior to making any corporate decisions, she arranges discussions and consults with workers across all levels of her enterprise. She then formulates her final executive directives based on those collaborative discussions. Because her directive methodology relies firmly on bidirectional communication, mutual respect, and workforce consensus, it perfectly embodies the principles of consultative direction.","In my opinion, Mrs. Sumi's strategies are no longer working due to a core problem in direction known as the ""Lack of Secrecy"" (গোপনীয়তার অভাব) and the ""Imitation of Strategies by Competitors"" (প্রতিযোগী কর্তৃক কৌশল অনুকরণ).


In contemporary strategic management, directions and business strategies must maintain a high level of operational secrecy to provide a competitive edge. If a manager's methods, special promotional tactics, or execution plans become easily visible to external entities, competitor firms can quickly duplicate those exact systems, neutralizing the original organization's competitive advantage and market distinctiveness.


As displayed in the file image_e4d90c.png, Mrs. Sumi involves workers of all levels in her decision-making process through wide-open consultations. While this open-door policy succeeded in making the workers delighted and highly motivated, it inadvertently compromised the institutional confidentiality of her operational strategies. Because the information was accessible to employees across all tiers, the strategies leaked or became easily apparent to the public. As a result, rival companies completely imitated her collaborative techniques and strategic formats, making her unique strategies ineffective and causing her immense worry.


Therefore, it can be concluded that while consultative direction is excellent for morale, a leader must carefully balance participative management with tactical security. To overcome this crisis, Mrs. Sumi needs to classify her directions: she can maintain democratic openness for routine factory operations, but must safeguard core strategic, financial, and competitive decisions within a closed executive circle. Protecting her key corporate secrets from being leaked or copied will allow her to regain her competitive edge and secure her market position."
2023,Business Organization and Management 2nd Paper,Leadership,Chittagong,Board,"Mr. Sifat and Mr. Rifat are two friends. The two of them have two business organizations. Before giving directions in his organization, Mr. Sifat discusses the subject matter of the direction openly with them and takes their opinions in special cases. On the other hand, Mr. Rifat retains all power with himself and makes decisions according to his own will. This has a negative impact on the subordinates. As a result, the organization is failing to survive in the competition.",Who is called a leader?,Why does direction flow downward? Explain.,What type of direction is present in Mr. Sifat's organization? Explain.,Analyze the type of leadership responsible for the downfall of Mr. Rifat's organization in the light of the stem.,"A leader is an individual who possesses the ability, position, and qualities to guide, influence, direct, and inspire a group of subordinates to work willingly toward achieving predefined organizational objectives.","Direction flows downward because it is an administrative instruction that originates from superior authorities and moves along the formal chain of command to be executed by subordinates.


In management hierarchy, executive authority is concentrated at the top. Superiors hold the structural responsibility to plan, organize, and allocate duties. Because a supervisor has the legal right to command and guide those lower in the organizational tier, orders, guidelines, and work strategies are naturally passed from the higher management levels down to operational levels for implementation.","In the stem, ""Consultative Direction"" (পরামর্শমূলক নির্দেশনা) is present in Mr. Sifat's organization.


Consultative direction is a modern, employee-centric management approach where a supervisor openly discusses operational tasks, shares insights, and actively seeks suggestions or opinions from subordinates before finalizing policies and issuing formal orders. By involving the workforce in the decision-making phase, this style fulfills the employees' psychological need for recognition, eliminates execution resistance, and fosters a collaborative working culture.


According to the file image_e4dc8c.png, Mr. Sifat does not rely on isolated commands. Instead, before issuing any administrative directions to his team, he conducts open discussions regarding the core subject matter of those instructions and values their opinions in specific scenarios. Because his instructional process depends firmly on bidirectional communication, transparency, and workforce participation rather than central force, it perfectly matches the textbook definition of consultative direction.","The type of leadership responsible for the downfall of Mr. Rifat's organization is ""Autocratic / Authoritarian Leadership"" (স্বৈরতান্ত্রিক নেতৃত্ব).


Autocratic leadership is a centralized management model where the leader retains all decision-making authority, acts in isolation, and relies heavily on formal power, fear, or strict compliance to execute plans. Under this style, subordinates are completely denied a voice in the organization's strategic loop, which damages employee morale, creates internal operational friction, and stifles collective innovation.


According to the file image_e4dc8c.png, Mr. Rifat hoards all institutional power to himself and forces decisions entirely based on his own whims without any dialogue. This rigid practice created a heavy negative impact on his subordinates. Because the employees feel alienated, micromanaged, and undervalued, their motivation collapsed, which triggered a decline in overall organizational efficiency.


In a dynamic and competitive market environment, businesses require an agile, highly motivated workforce to innovate and adapt. Mr. Rifat's extreme authoritarian behavior suffocated his team's enthusiasm and productivity, directly causing the firm to fall behind its market rivals. Therefore, it can be concluded that his autocratic leadership style is the fundamental reason his organization cannot survive in the competition."
2023,Business Organization and Management 2nd Paper,Leadership,Chittagong,Board,"The executive of a manufacturing organization leads the organization by rising above fear in any situation. He does not break down easily. But in terms of leadership, he gives absolute freedom to his subordinates. He keeps himself distant from his subordinates. He merely steps aside after setting the targets. As a result, despite being a person of such strong mentality, he is unable to be successful. A kind of chaos prevails in the organization.",What is formal leadership?,Why is leadership important in achieving goals? Explain.,Which type of leader's quality is expressed in the stem? Explain.,"""A change in leadership style can bring success to the organization in the stem""—Do you agree? Analyze your opinion.","Formal leadership is a structured management style where a leader derives explicit legal authority and executive power directly from an official organizational hierarchy, rules, and corporate designations to guide and instruct subordinates.","Leadership is important in achieving goals because it acts as the primary guiding force that integrates individual efforts into a unified, focused corporate direction.


Without effective leadership, an organization's resources, strategies, and plans remain scattered. A competent leader sets a clear vision, motivates the workforce, coordinates tasks across departments, and resolves operational conflicts. By providing continuous direction and inspiring spontaneous dedication, leadership transforms a group of separate individuals into a cohesive team capable of overcoming business challenges and reaching predefined structural targets.","In the stem, the leader's qualities of ""Courage"" (সাহসিকতা) and ""Patience or Mental Strength"" (ধৈর্য ও দৃঢ় মানসিকতা) are expressed initially.


An ideal leader must possess certain psychological and behavioral traits to steer an enterprise effectively. Among these, courage allows an executive to make bold decisions and lead from the front without succumbing to anxiety or external pressures during market crises. Similarly, mental strength and patience prevent a manager from breaking down during sudden operational failures, ensuring corporate stability.


According to the file image_e4dd24.png, the executive of the manufacturing firm leads his team by rising completely above fear in any critical situation. The text explicitly notes that he does not break down easily under pressure, highlighting his strong mentality. These specific attributes perfectly reflect the textbook definitions of managerial courage and psychological resilience required in business administration.","Yes, I entirely agree with the statement that ""A change in leadership style can bring success to the organization in the stem."" The leader must shift from ""Laissez-faire (Free-rein) Leadership"" (লাগামহীন নেতৃত্ব) to ""Democratic Leadership"" (গণতান্ত্রিক বা অংশগ্রহণমূলক নেতৃত্ব).


Laissez-faire leadership is a style where the manager completely detaches themselves from routine operations, avoids exercising executive power, and leaves all decision-making to subordinates after merely stating a goal. While this grants maximum autonomy, it typically backfires in manufacturing environments because a lack of coordination, accountability, and active supervision leads to extreme organizational indiscipline, low efficiency, and systemic failure.


As displayed in the file image_e4dd24.png, despite having great personal courage, the executive fails because he gives absolute, unchecked freedom to his subordinates and isolates himself from them. By stepping aside completely after setting targets, he created a severe managerial vacuum. Without active direction or a proper chain of accountability, a state of complete chaos prevailed across the factory, preventing the company from being successful.


To resolve this crisis, changing the leadership format is absolutely necessary. Transitioning to a democratic or consultative style will allow the executive to utilize his strong personality productively. By remaining actively involved, guiding operational workflows, and maintaining vital supervisory control while still valuing employee inputs, he can eliminate factory chaos. Re-establishing systematic command and performance tracking will restore workplace discipline, optimize worker productivity, and smoothly steer the manufacturing enterprise toward commercial success."
2023,Business Organization and Management 2nd Paper,Leadership,Jessore,Board,"Mr. Tuhin is the owner of a small garments factory. He sells his produced goods in the domestic market. He fixes the production targets entirely by himself. After that, he keeps himself distant from the workers. The workers decide by themselves what needs to be done and what does not need to be done. He is unwilling to take the risk of changing products to meet the changing demands in the market.",What is leadership?,Why should a leader avoid excessive emotion? Explain.,What type of leadership is followed by Mr. Tuhin in the stem? Explain.,"""Taking risks is one of the ways to survive in business""—Do you agree with the statement? Explain.","Leadership is the managerial process of guiding, influencing, and inspiring a group of subordinates to work willingly, enthusiastically, and cooperatively toward achieving specific organizational goals.","A leader must avoid excessive emotion because intense emotional impulses cloud rational judgment, distort objective decision-making, and undermine professional authority.


In management, critical operational challenges and crises require logical evaluation, stability, and data-driven solutions. If a leader reacts out of extreme anger, affection, or panic, it destroys workplace discipline, creates favoritism or internal inconsistency, and misguides subordinates, ultimately leading to organizational instability and failure.","In the stem, Mr. Tuhin follows ""Laissez-faire / Free-rein Leadership"" (লাগামহীন বা মুক্ত নেতৃত্ব) style in the execution phase of his factory.


Laissez-faire leadership is a style where the manager completely detaches themselves from daily executive operations, avoids exercising active supervisory control, and leaves all decision-making regarding task execution entirely to the subordinates after merely stating a goal. Under this approach, the leader does not provide active guidance or enforce strict accountability, creating a management vacuum where workers operate independently without structured coordination.


According to the file image_e4e04b.png, after setting the production targets by himself, Mr. Tuhin consciously distances himself from his workforce. The text explicitly highlights that the workers themselves decide what tasks to perform and what to avoid without any intervention or direction from him. Because he completely abdicates his ongoing supervisory role and hands over absolute, unchecked operational freedom to his staff, his management style represents a textbook definition of laissez-faire leadership.","Yes, I entirely agree with the statement that ""Taking risks is one of the ways to survive in business"" (ঝুঁকি গ্রহণ ব্যবসায় টিকে থাকার অন্যতম একটি উপায়).


Risk-taking is a fundamental prerequisite for corporate survival and growth because contemporary market environments are highly dynamic, characterized by constantly changing consumer tastes, technological updates, and aggressive rival competitions. An entrepreneur who strictly avoids taking calculated hazards and clings to stagnant traditional operational patterns will inevitably face product obsolescence, losing market share to agile competitors who adapt to external shifts.


As displayed in the file image_e4e04b.png, Mr. Tuhin refuses to take the strategic risk of changing or modernizing his garment products to cater to the evolving demands of the domestic market. In the fashion and apparel industry, consumer preferences change rapidly; failing to update designs or fabrics causes production inventory to remain unsold. By remaining completely risk-averse, his factory cannot realign its outputs with consumer trends, directly threatening the long-term viability and competitive survival of his enterprise.


Therefore, it can be firmly analyzed that risk-bearing is indispensable in business administration. To safeguard market sustainability, an ideal leader must combine structured foresight with a courageous willingness to accept calculations of uncertainty. Embracing innovative changes allows a firm to capitalize on timely market opportunities, meet changing consumer demands, and secure a strong, continuous position in a competitive landscape."
2023,Business Organization and Management 2nd Paper,Leadership,Jessore,Board,"Mr. Rashed is an executive officer of a service-oriented organization. He does not make any decision completely alone. When there is a need to give directions to subordinates on any matter, he sits down and discusses it with them. As a result, the employees remain happy and cooperate with him in various ways. However, he does not do this for highly urgent matters.",What is direction?,Why is it desirable for directions to be in writing? Explain.,What type of direction method does Mr. Rashed follow in the stem? Explain.,What is the justification for Mr. Rashed not consulting with employees on highly urgent matters? Explain.,"Direction is the managerial process of instructing, guiding, counseling, motivating, and supervising subordinates to perform tasks effectively to achieve organizational objectives.","It is highly desirable for directions to be in writing because written instructions provide absolute clarity, serve as an official record, and permanently eliminate communication gaps or misunderstandings.


When a directive is documented, it minimizes the risk of subordinates forgetting or misinterpreting complex technical details. Furthermore, a written order establishes formal accountability, makes future supervision and control seamless, and can be easily preserved as legal or operational evidence for long-term organizational reference.","In the stem, Mr. Rashed follows ""Consultative Direction"" (পরামর্শমূলক নির্দেশনা) as his core instructional method.


Consultative direction is a modern, employee-centered management approach where a supervisor actively discusses issues, exchanges conceptual insights, and seeks opinions from subordinates before finalizing and issuing formal instructions. Instead of enforcing high-handed top-down commands, this method values human capital, breaks down workplace friction, and heavily increases employee motivation because the workforce feels respected as essential planning partners.


According to the file image_e4e0cd.png, Mr. Rashed rejects centralized, isolated decision-making in his daily administrative routines. Whenever a strategic or operational direction needs to be handed down, he systematically sits down with his staff members to discuss and review the subject matter openly. This participative communication satisfies his workers and inspires them to cooperate enthusiastially with the firm's leadership. Since his routine approach relies firmly on mutual discussion and workforce consensus rather than arbitrary dictation, it perfectly embodies consultative direction.","The practice of Mr. Rashed avoiding employee consultation during highly urgent scenarios is completely justified because crisis situations demand ""Immediate Decision-Making"" (তাৎক্ষণিক সিদ্ধান্ত গ্রহণ) and ""Swift Operational Execution"" (কাজের দ্রুত বাস্তবায়ন).


While participative and consultative methods are excellent for routine operations, they are inherently time-consuming since arranging meetings, exchanging arguments, and building a workforce consensus takes substantial time. In an organization, certain emergencies arise—such as sudden market shocks, critical operational failures, or legal hazards—where even a minor delay in taking action can cause massive structural damages, financial losses, or complete failure of the service framework.


As indicated in the file image_e4e0cd.png, Mr. Rashed actively switches off his consultative model when dealing with highly urgent matters. During these high-pressure, time-sensitive situations, a leader must act decisively by exercising centralized authority to issue immediate commands. Bypassing prolonged team discussions ensures that the organizational resources are deployed instantly to mitigate the active threat without wasting crucial moments.


Therefore, it can be firmly analyzed that his dual management style is highly rational and realistic. Maintaining an adaptable balance—using democratic consultation for steady-state activities to maintain high employee morale, while relying on authoritative, swift commands during emergencies—is a standard hallmark of effective administrative leadership, safeguarding the enterprise from unforeseen operational crises."
