Year,Subject,Chapter,Level,Category,Stem,Question_A,Question_B,Question_C,Question_D,Ans_A,Ans_B,Ans_C,Ans_D
2025,Business Organization and Management 2nd Paper,Leadership,Dinajpur,Board,"Mr. Bari prioritizes getting work done without considering the benefits and facilities of the workers. Without forecasting the future of the product, he produces excessive goods for the purpose of sale. Later, he fails to sell those produced goods, which faces the organization into a financial loss.",What is an aptitude test?,What is meant by consultative direction? Explain.,Which type of leadership does Mr. Bari follow in the stem? Explain.,"Analyze the importance, in the light of the stem, of the quality of an ideal leader that Mr. Bari lacked, which caused his organization to face a loss.","An aptitude test is a selection mechanism used to evaluate a candidate's inherent capacity, potential, and quick learning ability to perform specific tasks or acquire new skills.","Consultative direction refers to a modern, human-centric technique where a supervisor actively holds discussions and seeks advice from subordinates before issuing final operational instructions.


Under this approach, orders are not imposed unilaterally; instead, employees are given a platform to share their field insights and practical suggestions. This participative method minimizes workplace resistance, bridges the communication gap between management tiers, and drastically boosts worker motivation because the team feels inherently valued and respected by the administration.","In the stem, Mr. Bari follows an ""Autocratic Leadership"" (স্বৈরতান্ত্রিক নেতৃত্ব) style.


Autocratic leadership is a centralized management style where the executive focuses solely on task accomplishment, retains absolute decision-making power, and shows little to no consideration for the thoughts, feelings, or well-being of subordinates. This type of leader treats workers merely as economic or mechanical tools to extract labor, relying on strong commands rather than employee collaboration to drive structural operations.


According to the file image_da67ff.png, Mr. Bari focuses heavily on getting work done while completely ignoring the necessary benefits and operational facilities of his workers. He manages the firm through a one-way, authoritative stance that completely bypasses human-centric welfare and participatory inputs. Since his management model centralizes power and aggressively prioritizes absolute production over employee development, it directly mirrors the characteristics of autocratic leadership.","The vital quality of an ideal leader that Mr. Bari lacked, which directly caused his firm to face an economic crisis, is ""Foresight"" or Far-sightedness (দূরদর্শিতা).


Foresight is the mental capacity of a manager to look ahead into the future, analyze past metrics, evaluate existing environmental trends, and accurately calculate potential market risks or demand changes before executing large-scale operations. In contemporary business landscapes, economic conditions fluctuate constantly, and strategic foresight serves as the ultimate protective shield that helps a leader balance output volumes with real-world consumer demands, steering clear of institutional resource wastage.


As illustrated in the file image_da67ff.png, Mr. Bari initiated heavy manufacturing of goods purely for the sake of selling, without carrying out any systematic product forecasting or market analysis. Lacking strategic foresight, he failed to gauge true consumer trends, causing him to manufacture excessive inventory that ultimately remained completely unsold in warehouses. This severe overproduction locked up vital corporate capital, directly resulting in massive financial losses for his business enterprise.


Therefore, it can be concluded that foresight is an indispensable quality that can never be substituted in business administration. Had Mr. Bari possessed far-sighted vision, he would have accurately synchronized his factory's production schedule with projected market demands. His failure demonstrates that without structural foresight, an executive's choices become blind gambles, inevitably resulting in a total collapse of organizational productivity and severe corporate failure."
2025,Business Organization and Management 2nd Paper,Leadership,Mymensingh,Board,"Mrs. Kakoli, the manager of 'Ayana Enterprise', makes decisions after discussion and consultation with her workers. This inspires the workers to perform their tasks spontaneously. Above all, due to Mrs. Kakoli's charming personality, sharp intelligence, and wisdom, the success of the organization is increasing day by day.",What is direction?,How do a leader and a manager differ? Explain.,"Based on the exercise of authority, what type of leadership is present in Mrs. Kakoli's leadership in the stem? Explain.",Can Mrs. Kakoli be called an ideal leader in the stem? Analyze with arguments.,"Direction is the managerial process of instructing, guiding, counseling, motivating, and supervising subordinates to perform tasks effectively to achieve organizational objectives.","A leader and a manager differ primarily in their source of power and their approach to influencing people.


A manager holds formal authority derived from an institutional position or organizational hierarchy and focuses heavily on maintaining structure, planning budgets, and system compliance. Conversely, a leader's power stems from personal influence, vision, and the ability to win the trust of others, focusing on inspiring, motivating, and transforming people rather than just exercising formal institutional command.","Based on the exercise of authority, ""Democratic Leadership"" (গণতান্ত্রিক বা অংশগ্রহণমূলক নেতৃত্ব) is present in Mrs. Kakoli's leadership style.


Based on the exercise of power and authority, leadership is classified into various types, with democratic leadership being characterized by an inclusive approach where the leader shares decision-making power. Instead of imposing unilateral orders, a democratic leader respects the human capital of the firm, actively listens to the suggestions of subordinates, and encourages workplace participation before formalizing operational policies.


According to the file image_da689a.png, Mrs. Kakoli does not act as an isolated dictator at Ayana Enterprise; she systematically makes crucial business choices only after sitting down for complete discussion and consultation with her workers. By creating a consultative network, she treats her staff as respected operational partners rather than mechanical tools. This strategic distribution of executive planning perfectly aligns with the standard definitions of democratic leadership.","Yes, based on the facts provided in the stem, Mrs. Kakoli can undoubtedly be called an ""Ideal Leader"" (আদর্শ নেতা).


An ideal leader is an individual who possesses a harmonious blend of fundamental professional skills and exceptional personal qualities that successfully influence, inspire, and guide subordinates to work spontaneously toward collective organizational milestones. A leader earns this status by maintaining high emotional intelligence, sharp decision-making capabilities, and a human-centric management style that respects employee values.


According to the file image_da689a.png, Mrs. Kakoli implements democratic leadership, which makes her workers feel profoundly valued, valued, and integrated into the firm's strategic goals. This respectful environment inspires her workforce to perform their respective field operations with spontaneous enthusiasm and dedication. Furthermore, the stem explicitly highlights that she possesses a unique set of core behavioral and intellectual traits, such as a charming personality, sharp intelligence, and deep wisdom.


Therefore, it can be firmly analyzed that Mrs. Kakoli fulfills all textbook criteria of an ideal leader. Her technical ability to secure spontaneous worker execution, combined with her strong cognitive traits and consultative mindset, has directly resulted in the continuous day-by-day commercial growth of Ayana Enterprise, proving that she is an excellent role model in business administration."
2023,Business Organization and Management 2nd Paper,Leadership,Rajshahi,Board,"Mrs. Aresha is the owner of a bread manufacturing factory. She set a target of producing 60 thousand pieces of bread per month and sought the opinions of the workers engaged in the production work. Subsequently, based on the workers' opinions, the monthly production target was fixed at 50 thousand pieces. She gives directions keeping in view that the workers get a complete picture of their work. Besides, because Mrs. Aresha gives directions at the right time and in the right way, the workers face no problems in achieving their goals.",What is called direction?,What is meant by laissez-faire leadership? Explain.,What type of direction does Mrs. Aresha follow in her bread manufacturing factory in the stem? Explain.,"""The effectiveness of direction depends on employee acceptance""—Evaluate the statement in the light of the stem.","Direction is the managerial process of instructing, guiding, counseling, motivating, and supervising subordinates to execute tasks effectively to achieve organizational objectives.","Laissez-faire (free-rein) leadership refers to a style where the leader gives complete decision-making freedom to subordinates and entirely avoids exercising direct executive control.


Under this style, the leader does not issue formal orders, guide daily tasks, or hold accountability, leaving employees to set their own goals and solve problems independently. While it offers maximum autonomy, it often leads to organizational chaos, a lack of discipline, and a loss of direction unless the subordinates are highly skilled, self-motivated professionals.","In the stem, Mrs. Aresha follows ""Consultative Direction"" (পরামর্শমূলক নির্দেশনা) in her bread manufacturing factory.


Consultative direction is a modern, employee-centered directing technique where a supervisor actively discusses issues, exchanges ideas, and seeks opinions from subordinates before issuing final instructions or orders. By involving the executing staff in the planning phase, it breaks down administrative barriers, minimizes internal resistance, and elevates employee dedication because the workers feel inherently respected and valued as human assets.


According to the file image_da6c01.png, Mrs. Aresha did not unilaterally impose her initial monthly target of producing 60 thousand pieces of bread. Instead, she sought the feedback and opinions of the workers engaged in production, and based on their realistic field inputs, she logically adjusted the target to 50 thousand pieces. Since she systematically places mutual consultation and participative feedback at the heart of her directive process, her methodology represents a textbook example of consultative direction.","The statement ""The effectiveness of direction depends on employee acceptance"" (নির্দেশনার কার্যকারিতা কর্মীর গ্রহণযোগ্যতার উপর নির্ভরশীল) is entirely true and highly justified in the light of the stem.


In management, direction cannot achieve its goals if it is blindly forced upon a workforce; its ultimate success relies heavily on how spontaneously and willingly the employees accept, understand, and commit to the instruction. When a leader provides realistic instructions that consider the workers' capacity, gives a complete picture of the tasks, and delivers them at the right time, the workforce accepts the directive with high motivation, leading to flawless operational execution.


The file image_da6c01.png highlights that Mrs. Aresha initially planned a target of 60 thousand pieces, but rather than demanding blind compliance, she valued her workers' input, which led to a highly acceptable target of 50 thousand pieces. Furthermore, she designed her guidelines so that the workers received a crystal-clear, complete picture of their duties, and she consistently delivered these directions at the right time and in the right way. Because the directives perfectly aligned with the workers' capabilities and psychological readiness, they were completely accepted by the staff, resulting in zero operational friction or problems in goal achievement.


Therefore, it can be firmly analyzed that employee acceptance is the ultimate measure of effective direction. Mrs. Aresha's factory proves that when instructions are collaborative, clear, and well-timed, they gain absolute acceptance from subordinates, transforming administrative plans into high operational productivity and flawless institutional success."
2023,Business Organization and Management 2nd Paper,Leadership,Rajshahi,Board,"Mr. Sohel is the owner of a large-scale poultry farm. He gives strict direction to the workers to manage various farm activities. The workers follow the direction. No interest is seen in Mr. Sohel in taking the opinions of the workers. This creates dissatisfaction among the workers and they become inattentive to work. As a result, the farm faces a financial loss. In this situation, Mr. Sohel is worried about ensuring the opinions, advice, and participation of the workers.",Who is a leader?,"""Group effort is impossible without leadership""—Explain.",Which type of leadership does Mr. Sohel follow in the stem? Explain.,Analyze the type of leadership required to stop the loss of the farm in the stem.,"A leader is an individual who possesses the formal or informal authority, personal influence, and capability to guide, direct, inspire, and motivate a group of subordinates to work enthusiastically toward achieving specific goals.","The statement ""Group effort is impossible without leadership"" signifies that a collection of individuals cannot achieve a unified objective unless a coordinating force binds them together.


In any collaborative environment, separate individuals carry different mindsets, skills, and working speeds. Without a leader to establish a clear vision, allocate specific roles, resolve internal conflicts, and steer collective energies in a single direction, group efforts quickly devolve into chaos, miscommunication, and structural paralysis; hence, leadership is the vital engine that transforms an unorganized crowd into a cohesive, goal-oriented team.","In the stem, Mr. Sohel follows an ""Autocratic Leadership"" (স্বৈরতান্ত্রিক নেতৃত্ব) style.


Autocratic leadership is a highly centralized management approach where the leader concentrates all decision-making authority in their own hands, issues strict, one-way commands, and demands absolute obedience from subordinates. An autocratic manager shows little to no interest in employee feedback, treats workers as mere execution tools, and relies on strict supervision or fear rather than collaboration to accomplish workplace tasks.


According to the file image_da6f28.png, Mr. Sohel manages his large poultry farm by giving rigid, uncompromising directions to his workers without allowing any room for dialogue. The text explicitly highlights that he has absolutely zero interest in welcoming or considering the opinions and feedback of his workforce. By maintaining this uncooperative, top-down command structure, he caused deep dissatisfaction to spread among his staff, making them inattentive and detached from their tasks. This pattern of behavior perfectly matches the structural profile of autocratic leadership.","To stop the ongoing financial losses and rebuild the farm's operational efficiency, Mr. Sohel needs to adopt ""Democratic Leadership"" (গণতান্ত্রিক বা অংশগ্রহণমূলক নেতৃত্ব).


Democratic leadership is an inclusive management model where the supervisor shares decision-making power by actively seeking opinions, encouraging field advice, and ensuring the structural participation of subordinates before finalizing action plans. This participative framework eliminates workplace alienation, re-establishes employee morale, and inspires workers to perform their tasks with spontaneous responsibility because they feel humanly valued and integral to the institution's success.


As shown in the file image_da6f28.png, Mr. Sohel's previous autocratic approach severely backfired; excluding the workers generated strong internal dissatisfaction and led to a costly drop in attentiveness, plunging the large poultry farm into financial losses. In the face of this crisis, Mr. Sohel himself is already worried about incorporating the opinions, advice, and direct participation of his workforce. Transitioning to a democratic system is the exact remedy required here, as it will directly address the root cause of the employees' dissatisfaction.


Therefore, it can be firmly analyzed that democratic leadership is the only effective way forward to save the enterprise. By establishing a cooperative workspace where poultry handlers and field workers are consulted on routine activities, Mr. Sohel can successfully eliminate employee negligence, boost operational vigilance, and turn the farm's financial losses back into sustainable commercial growth."
2023,Business Organization and Management 2nd Paper,Leadership,Comilla,Board,"Mr. Faruk is the manager of Shifa Textile. He delegates necessary authority to his subordinates and takes everyone's advice before making decisions. One of his special qualities is to get work done by encouraging and inspiring the subordinate workers. As a result, the workers achieve targets while gaining job satisfaction, which makes the management satisfied with Mr. Faruk as well.",What is task-oriented leadership?,Why does a misconception arise about the director in consultative direction? Explain.,"Based on the style of power exercise, what type of leadership is followed by Mr. Faruk? Explain.",Do you think that Mr. Faruk's special quality has made it easier to achieve the organization's goals? Give your opinion.,"Task-oriented leadership is a management style where the leader focuses primarily on task completion, structural execution, and operational efficiency rather than human relationships or employee welfare.","A misconception can arise about the director in consultative direction because some subordinates might misinterpret the supervisor's willingness to consult as a sign of weakness, indecisiveness, or lack of personal capability.


When a director continuously seeks suggestions, takes feedback, and discusses matters with the team before issuing formal orders, uneducated or less professional workers may feel that the leader is incompetent to make choices alone. This democratic openness can inadvertently lead subordinates to undermine executive authority or view the consultative approach as a lack of professional confidence on the part of the management tier.","Based on the style of power exercise, Mr. Faruk follows ""Democratic Leadership"" (গণতান্ত্রিক বা অংশগ্রহণমূলক নেতৃত্ব).


On the basis of authority patterns, leadership is classified into various styles, where democratic leadership stands out as an inclusive methodology that rejects centralized dictatorial rules. Under this model, the leader delegates operational authority, values human resources, and establishes a system where the opinions and suggestions of subordinates are thoroughly weighed before any strategic decisions are finalized.


According to the file image_e47b71.png, Mr. Faruk behaves as a classic democratic manager at Shifa Textile by actively transferring necessary execution powers down to his subordinates. Furthermore, he explicitly brings his workforce into the decision-making loop by gathering everyone's advice before formulating organizational plans. By balancing his managerial power with staff consensus instead of executing unilateral commands, his style completely matches the definition of democratic leadership.","Yes, I firmly believe that Mr. Faruk's special quality, which is ""The Ability to Motivate and Inspire"" (অনুপ্রাণিত ও উৎসাহিত করার ক্ষমতা), has significantly eased the achievement of the organization's targets.


In modern corporate management, merely issuing technical guidelines or deploying advanced machinery cannot secure peak production unless the human elements are psychologically energized. An ideal leader uses motivation as a strategic mechanism to remove workplace monotony, build corporate loyalty, and bridge the emotional distance between the workforce and top management, transforming routine tasks into voluntary efforts.


As displayed in the file image_e47b71.png, Mr. Faruk possesses an exceptional talent for driving productivity not through coercive surveillance, but by lifting employee morale and offering inspiration. This supportive attitude directly resulted in the textile workers attaining a high degree of job satisfaction while pursuing company milestones. When employees feel humanly valued and emotionally driven by their leader, they minimize resource wastage, handle operational challenges creatively, and work with maximum dedication.


Therefore, it can be concluded that this motivational quality served as the primary catalyst for Shifa Textile's structural success. By turning mechanical execution into inspired performance, Mr. Faruk boosted production speed and generated widespread operational harmony, proving that a leader's capacity to motivate is an indispensable asset for seamless goal achievement and organizational prosperity."
